location_name,review_text,rating,review_date
Taman EcoWisata Cimenteng,"Salah satu destinasi wisata di kota Cimahi yg berwawasan lingkungan, dilengkapi dengan pasar awi sebagai pusat kulineran walaupun masih buka minggu ke satu dan ketiga setiap bulannya",5,2024-09-02
Taman EcoWisata Cimenteng,"Ewic eko wisata cimenteng,tempatnya luas adem,sejuk banget karena si penuhi dgn tanaman bambu..tmptnya asri baget,keren pokoknya..",5,2024-08-11
Taman EcoWisata Cimenteng,"Alhamdulillah setiap minggu pagi kesini. Healing murah meriah, jajanan lengkap dan aman di kantong.
Yuk kesini, refresh raga dan jiwa.
Badan sehat, perut kenyang, kantong aman..
.. 😆🥰",5,2024-08-11
Taman EcoWisata Cimenteng,"Sekarang sudah lebih bersih, rapih, dan menyenangkan untuk menjadi tempat olahraga saya",4,2024-08-07
Taman EcoWisata Cimenteng,"Bagus, areanya luas, adem banget kerasa nuansa kampung nya. Bnyakbtemoat buat istirahat juga, yg penting tetep dirawat ya jangan awal2 nya aja 😁",5,2024-07-28
Taman EcoWisata Cimenteng,"Bnyak tukng parkir ,  ganggu",1,2024-07-22
Taman EcoWisata Cimenteng,Tahu dr Tiktok wah mau dong... Kan warga Cimohai hrs lah kesini,5,2024-07-12
Taman EcoWisata Cimenteng,"Tempatnya sejuk dan asri,,  bersih dan nyaman.mantaplah dan menyala abangkuhhhh🔥👌",5,2024-07-07
Taman EcoWisata Cimenteng,Lapangannya bisa utk bermain anak-anak dan gratis,5,2024-06-27
Taman EcoWisata Cimenteng,"Tempatnya luas, udaranya bersih, pemandangannya asri, sangat menyatu dengan alam. Ada gazeebo buat duduk duduk dan ngemil. Ada air mancur yg kolamnya ada ikan ikannya. Tersedia toilet dan mushola. Di sini bala bala nya enak banget kalau pagi masih panas panas kriuk mantappppp..",5,2024-06-22
Taman EcoWisata Cimenteng,"Alhamdulillah.. Tempatnya Aman, Nyaman, bersih, ada Musholanya juga, Luas.. WC.nya terawat.. Parkiran Luas..",5,2024-06-22
Taman EcoWisata Cimenteng,Kurang menarik...suasananya,2,2024-06-18
Taman EcoWisata Cimenteng,Tujuan jalan/lari pagi yg Indah di Utaranya Cimahi. Tempatnya nyaman.. lumayan murah tempat jajannya.,5,2024-06-17
Taman EcoWisata Cimenteng,udara nya seger,4,2024-06-15
Taman EcoWisata Cimenteng,Very peaceful,5,2024-06-15
Taman EcoWisata Cimenteng,"Tempatnya enak bgt buat jalan"" pagi n olahraga udara nya segar masih asri bgt,ini tuh tempat wisata baru di Cimahi terutama di daerah cipageran klo weekend bisa senam atau main bulu tangkis atau yg mau botram jg bisa ada saung"" di atasnya , klo pas ada event suka ada pasar tradisional di pasar awi di atas jajannya mesti tukar koin dl seperti di floating market pecahan 5 dan 10 ,lokasinya aga masuk LG dari jalan utama",5,2024-06-12
Taman EcoWisata Cimenteng,"Tempatnya luas, sejuk
Wisata alam dan gratis",5,2024-06-12
Taman EcoWisata Cimenteng,Tempat wisata murah cuma bayar parkir ajah.. enak buat botram sama keluarga atau sekedar ajak main anak.,4,2024-06-09
Taman EcoWisata Cimenteng,"Bagus, bersih. Tapi anehnya kita di pungut biaya karna diem di pendopo paling besar di sana.. Si bapaknya bilang buat uang kebersihan dll. Tapi pengunjung yang lain ga di pinta bayaran waktu diem di tempat yang sama.. Aneh kan.. Entah itu pungli atau bukan.",4,2024-06-04
Taman EcoWisata Cimenteng,Masih baru tapi cukup bagus untuk ajak anak-anak main kesini,5,2024-05-31
Taman EcoWisata Cimenteng,Tempatnya nyaman sejuk,5,2024-05-30
Taman EcoWisata Cimenteng,"Tempatnya bagus.. bisa dijadikan taman bermain, sejuk, viewnya kereen
Banyak spot foto, mushola dan toilet..
Pemandangannya asri cocok untuk healing👍😊",5,2024-05-28
Taman EcoWisata Cimenteng,Banyak spoot bwat photoshoot,5,2024-05-22
Taman EcoWisata Cimenteng,"Tempatnya sejuk sama cocok buat botram..
Buat jogging fisik jg pas bgt..
Recommended..",5,2024-05-19
Taman EcoWisata Cimenteng,Enakeunnn....,5,2024-05-19
Taman Alun-Alun Kota Cimahi,Alun Alun yg sudah tertata rapi. Nyaman utk istirahat siang. Ngaso dari aktivitas,5,2025-11-16
Taman Alun-Alun Kota Cimahi,Mantapp,5,2025-11-11
Taman Alun-Alun Kota Cimahi,1 permainan anak2 rata Rp 15.000 mungkin japrem nya mahal..,1,2025-11-09
Taman Alun-Alun Kota Cimahi,Platz zum verweilen,5,2025-11-08
Taman Alun-Alun Kota Cimahi,"The place is pretty good with all of the trees that make it shady, so, it was not hot, it was chill. It was a nice place.",4,2025-11-07
Taman Alun-Alun Kota Cimahi,Pitstop.,5,2025-11-06
Taman Alun-Alun Kota Cimahi,tempat bersantai bersih,5,2025-11-04
Taman Alun-Alun Kota Cimahi,"ramah untuk anak""bermain",5,2025-11-03
Taman EcoWisata Cimenteng,Bagus,5,2024-05-10
Taman EcoWisata Cimenteng,"Great & free place to family picnic.
Bersih, luas dan asri cocok pagi hari atau sore hari nongkrong sama keluarga kesini dan olahraga disini juga.

Bisa tembus ke taman kehati yang dikelola TNI setempat.

Ada warung buat makan mie, ngopi, gorengan, baso.

Ada mushola & toiletnya bersih.

Ingat kesini jangan buang sampah sembarangan.
Tempat syahduuuu buat kopi-kopi santai di hari libur.",5,2024-05-10
Taman EcoWisata Cimenteng,"Tempat botram dan nongkrong yang dekat dikelilingi kebun dan pepohonan yang menyejukkan. Kalau mau botram di gazebo nya, harus daftar dulu , gratis, hanya bayar uang kebersihan seikhlasnya 👍🏻",4,2024-05-09
Taman EcoWisata Cimenteng,"Tempat nya bersih, nyaman, sejuk, rekomen buat jalan jalan santai sama keluarga",5,2024-05-05
Pandiga Educreation Sports,Alhamdulillah..terima kasih SDH mengajak anak2 paud An-nahl bermain dan belajar di pandiga..,5,2026-04-27
Pandiga Educreation Sports,"kolam tenang ternyaman sih, soalnya ga begitu banyak bocil,",5,2026-04-23
Pandiga Educreation Sports,Best place buat olahraga. Dateng - renang - mandi - pulang. Ga terlalu rame ga banyak bocil 🤌🏻,5,2026-04-21
Pandiga Educreation Sports,Ini buka nya sebelum jam 7 ga yah?,5,2026-04-21
Pandiga Educreation Sports,"Cukup luas, sih. Parkir juga ga susah.
Sayangnya wc-nya agak kureng di sisi privasi meski sama gendernya, ga semua orang nyaman mandi di tempat terbuka tapi tertutup.
Tiap ke sini & sore, selalu ada yang bakar2 entah sampah/ apa, tebel pula asapnya 😷",4,2026-03-28
Pandiga Educreation Sports,"hrsnya kl uda penuh tiketnya jg diclose, jd terpaksa simpen barang di kursi jelek gini",1,2026-03-24
Pandiga Educreation Sports,"Cocok untuk komunitas yang ingin mengadakan kegiatan terlebih untuk pelajar, banyak hal yang dibantu mulai dari persiapan sapras hingga makanan, selalu memprioritaskan kemampuan dari komunitas yang ingin menggunakan pandiga sebagai tempat untuk kegiatan, pelayanan yang sangat berkualitas dan membantu",5,2026-03-10
Pandiga Educreation Sports,untuk kolam dalamnya tdk terlalu luas.. ensanya  air bilasnya hangat.. coba bisa sampai malam.. gazebo bnyk untuk menaruh barang,4,2026-03-05
Pandiga Educreation Sports,Nasgor buntut nya ok,5,2026-02-14
Pandiga Educreation Sports,"Kolamnya bersih. Tempat outboundnya seru. Makanannya juga enak-enak. So far beberapa kali kesana, tidak pernah mengecewakan. 👍🏻👍🏻",5,2026-02-13
Pandiga Educreation Sports,"Vibes kolamnya menyenangkan, suasananya tenang cocok utk yg emg mau olahraga renang. Ada musholanya, klo bw family jg aman krn ada kolam kecil dan ukuran sedangnya jg. Minusnya di kamar bilas sh, seperti kurang terawat",4,2026-02-03
Pandiga Educreation Sports,👍,5,2026-01-24
Pandiga Educreation Sports,"Kolam renangnya bersih, ada shower bilas di tepi kolam, ada penyewaan locker juga. kamar mandi prianya kurang bersih",4,2026-01-19
Pandiga Educreation Sports,"Ini review tanggal 1 Juni 2025.
Parkiran motornya cukup luas, tapi jaraknya agak jauh dari tempat pembelian tiket. Utk parkiran motornya tidak beratap jadi kalau hujan ya helmnya basah.
Utk area lobby cukup nyaman, ada toiletnya.
Di lobby bisa registrasi member & regitrasi apabila ingin mengadakan acara/hajatan di area outdoor samping kolam atau di lantai 2 gedung lobby.
Utk benefit membernya yaitu
- harga tiket masuk kolamnya jadi diskon 50%
- harga makanan diskon 10%

HTM weekday : 30.000
HTM weekend : 35.000
Ada penyewaan perlengkapan renang apabila tidak membawa dari rumah.

Kolam renangnya ada 3. Ada kedalaman utk balita, kedalaman utk anak-anak dan kedalaman orang dewasa.
Semua kolamnya air dingin.
Kolamnya cukup bersih, kadang bau kaporitnya tajam.
Ada area bilas di luar dan di dalam ruangan.
Kalau di dalam ruangan menggunakan air hangat, kalau di luar ruangan air dingin.
Toiletnya cukup bersih, cuma pintunya agak sulit ditutup (area laki-laki).
Ada loker juga.

Ada mushola, musholanya cukup utk 6 orang dewasa.
Musholanya terawat & nyaman.

Ada area outdoor, di sana anak-anak bisa bermain.
Ada flying fox, ada berjalan di atas tali dll.
Sebaiknya bermain ketika tidak musim hujan.
Karena ketika musim hujan areanya becek & banyak nyamuknya.
Kalau sedang ada acara, area outdoornya tidak bisa dipakai pengunjung kolam.

Ada sasaungan utk makan.
Menunya cukup variatif, rasanya enak dan harganya terjangkau.

Kesimpulannya Pandiga ini cukup nyaman utk dipakai berenang.
Fasilitasnya cukup lengkap, harganya terjangkau, kebersihannya cukup.

Edited 5 Agt 2025
- penambahan photo area kolam
- update menu resto

Edited 3 Oct 2025
- penambahan photo area outdoor",4,2026-01-18
Kampung Cireundeu,Historical,5,2026-04-21
Kampung Cireundeu,"Ceuk suamiku: kampung nu tumaninah. Ada pohon sawo, duren, nangka, dll.
Kalau kita kunjungi di Minggu pagi (buka pk.06.00) kita bisa wisata kuliner.

Mereka ada berbagai pilihan makanan tradisional dan olahan singkong.
Kurekomendasikan: comro (teksturnya renyah tetapi empuk, dan oncomnya enak serta tdk terlalu pedas). Kalau kesiangan bisa ga kebagian: nasi goreng tapi nasinya dari singkong alias rasi.

Minuman ada kopi tubruk dan bandrek. Sukaaaa 💚

WC ada beberapa utk perempuan dg toilet duduk dan toilet jongkok. Toilet perempuan dan laki-laki terpisah.

Utk oleh², selain di Bale Adat juga sebelum bale ada beberapa rumah yg jualan pangan olahan singkong, termasuk jual rasi.

Kalau bawa motor bisa masuk dari jalan lain dan ada tempat parkir utk kira² 10 motor. Kalau mobil harus janjian dg warga. Info lebih lengkap kontak mereka via IG @kampungadatcireundeu",5,2026-04-19
Kampung Cireundeu,Tempatnya enakeun. Sunda pisan. Oleh²nya berbahan dasar tepung singkong. Harga terjangkau.,5,2026-04-03
Kampung Cireundeu,"Beras cirendeu khas asli produk lokal terbuat dr singkong, rasanya lebih enak dr beras padai biasa.",4,2026-04-01
Kampung Cireundeu,There is nothing here.,1,2026-03-22
Kampung Cireundeu,Saya banyak belajar tentang sejarah serta arsitektur bangunan kampung Cireundeu. Namun hal yang paling membuat saya tertarik adalah tentang adanya 1000 tangga perjalanan menuju kampung dan kondisi air yang melimpah,5,2026-03-15
Kampung Cireundeu,"buat yg suka naik gunung, dan ingin mencoba naik tanpa alas kaki
yuk di coba datang ke kp.cireundeu",5,2026-03-11
Kampung Cireundeu,Sangat menyenangkan,4,2026-02-06
Kampung Cireundeu,"Kampung adat, yang ada di daerah cimahi. Dimana dikampung ini ada kearifan lokal baik kebiasaan. Makanan yang berasal dari singkong yang dibuat menjadi diversifikasi jenis makanan,baik beras, keripik. Eggroll, cireng, dan jenis makanan lainnya. Ada puncak salam untuk hiking",5,2026-01-28
Kampung Cireundeu,"Kampung Cireunde menawarkan pengalaman wisata budaya yang unik dengan suasana seperti perkampungan adat. Di sini terdapat rumah-rumah adat, bale-bale yang nyaman untuk bersantai, serta sentra oleh-oleh yang menjual berbagai hasil olahan khas buatan warga setempat. Lingkungannya tertata rapi dan kental dengan nuansa tradisional, cocok untuk wisata edukasi maupun kunjungan keluarga. Lokasinya juga cukup mudah dijangkau, dengan area parkir yang luas sehingga nyaman bagi pengunjung yang datang beramai-ramai.",5,2026-01-18
Kampung Cireundeu,"Kereeeennn
Buat spiritualis ini tempat bagus. Energi nya luar biasa",5,2026-01-15
Pandiga Educreation Sports,"Tempat outbound yg keren, recommended bgt buat anak-anak ada kolam renang dan Playground nya",5,2025-12-29
Pandiga Educreation Sports,"best swimming pool for kids.
and also have a outdoor activity kids in the backyard.
need improvement in the toilet and shower",5,2025-12-25
Pandiga Educreation Sports,"Pandiga Swimming Pool is my go to spot for healing and self therapy. It’s very affordable only 30k on weekdays and 35k on weekends. The entire place is spotless, from the pools and lounge area to the lobby and restrooms.
Even though there aren't many pool variations, I really enjoy swimming here. The food and drinks are tasty and reasonably priced, I personally loved the calamary and chicken wings. The staff are super friendly and recommended the Iced Creme Brulee, which was delicious!
The food presentation is neat, and the service is fast. I highly recommend this place if you’re looking for a comfortable, clean, and affordable swimming spot. Definitely the best pool in Cimahi!",5,2025-12-16
Pandiga Educreation Sports,Tempat nya asik..,5,2025-12-10
Pandiga Educreation Sports,"Antar cucu ikut lomba, tempat nya bagus bersih..acaranya juga tertib. Terimakasih.",5,2025-11-18
Pandiga Educreation Sports,Ok,5,2025-11-18
Pandiga Educreation Sports,"Ada kamar ganti laki dan perempuan. Masing masing Wc nya cuman 2 untuk di dalam kamar ganti. Yg 1 rusak, jadinya ngantri lama. Kamar ganti nya sempit banget, masuk 2 orang (ibu dan anak) aja ngepas. Dan ga ada pengunci pintu nya

Dengan harga tiket 30rb untuk weekday, lebih baik toilet di perbanyak di kamar ganti ,tiap kamar ganti ada shower untuk bilas atau mandi (jangan kamar ganti doang), dan tiap bilik kamar ganti bikin agak luas supaya nyaman",4,2025-11-16
Pandiga Educreation Sports,"Saya datang ke sini untuk liputan lomba renang. Area kolamnya cukup bersih dan tertata, dengan suasana yang mendukung kegiatan pertandingan. Fasilitasnya memadai, meski beberapa area terasa ramai saat event berlangsung. Secara keseluruhan, tempatnya cukup nyaman untuk kegiatan olahraga maupun event renang.",4,2025-11-16
Pandiga Educreation Sports,Kolam utk anak tk dan sd yg cukup menyenangkan,4,2025-10-28
Pandiga Educreation Sports,lumayan luas untuk kolam renang disekitar cimahi,5,2025-10-28
Kampung Cireundeu,"Tempat treking yang cukup bagus di Cimahi. Apalagi ada tantangan tersendirinya yaitu mendaki tanpa alas kaki. Unik jadinya. Dan di puncaknya bagus juga, view Bandung Raya cukup jelas. Sampai Masjid Al Jabbar aja kelihatan. Tidak ada tiket khusus disini.",5,2026-01-11
Kampung Cireundeu,"Kampung adat yang masih eksis di tengah kota Cimahi. Suasana yang adem, tenang jadi pilihan tepat buat kalian yang merindukan suasana di pedesaan. Rasi, makanan khas pengganti nasi terbuat dari sampeu alias singkong juga wajib dicoba! Enak bangett",5,2025-12-23
Kampung Cireundeu,"Orang-orang disini ramah, beberapa juga banyak teman saya. Rekomendasi kalau kesini, selain coba singkongnya, cobain juga seblaknya, katanya enak disini.

Saya sudah 3x ke Puncak Salam. Naik kesana tidak boleh menggunakan alas kaki, salah satu alasannya untuk menjaga alamnya. Tetapi tolong untuk pengunjung perhatikan sampahnya, agar tidak ada sampah di puncak, dan pengunjung tidak melakukan vandalisme (banyak tulisan di saung). Untuk pengelolanya bisa diperhatikan kembali, terimakasih😁",4,2025-12-22
Kampung Cireundeu,"Good vibes and we climbed the hill Salam in Kampung Cireundeu without the footwear (sandals or shoes), we enjoyed it. But we wait for the new upgrade system for visitors include ticketing, security, etc.",5,2025-12-21
Kampung Cireundeu,"Sabtu, 13 Desember 2025

SOLO HIKING

Ekspektasi aku itu pasti bakal rame. Bisa beli oleh-oleh khas Cireundeu dan lainnya. Tapi pas ke sana, huaaaa sedih takde apa-apa. Sepii. Hanya ada kegiatan anak sekolahan.

Terus ceritanya aku solo hiking kan, ya 😆 Aku beranikan diri buat lanjut hiking, awalnya agak was-was gitu soalnya sepi. Yaudah lah ya naik sendirian ke puncak salam wkwk. Itu dipikiran aku campuraduk, antara takut, menikmati suasana alam, di dalem hati terus berucap, ""Ya Allah, temani aku, temani aku, temani aku, sebenarnya aku takut"" 🤣

*yang paling excited mau hiking ke sini tuh karena harus barefoot alias nyeker. Dan memang manfaat grounding/nyeker tuh bagus banget buat kesehatan.

Pas udah sampai di puncak, Alhamdulillah biidznillah ada teteh-teteh yang lagi hiking juga. Huaaaa, di sini aku lega banget 😆 Maha Baik Allah. Jadi pas pulangnya barengan, deh. Jadi lebih enjoy dan gak was-was lagi.

Awalnya udah overthinking banget, takut ketemu orang jahat hahaha. Coba aku perempuan, ya sendiri lagi, ke hutan 🤣 Ya ampun, tapi seneng banget, sih.

Oh iya, tapi kayaknya kurang terawat ya sekarang mah area puncaknya. Terutama area camping, rumputnya tinggi banget.

Sekian reviewnya 💙🌱",5,2025-12-20
Kampung Cireundeu,Dari kampung Cirendeu kita belajar bahwasanya hidup harus selaras dengan alam agar dapat menciptakan keseimbangan dan kesinambungan,4,2025-12-11
Kampung Cireundeu,Kampung yg cantik.,5,2025-12-08
Kampung Cireundeu,Bagus untuk destinasi wisata budaya,5,2025-11-18
Kampung Cireundeu,"Aaaaaaa seneng bgttt akhirnya bisa berkunjung kesini pas lagi ada acara adat, vibes nya seruuu bgtttt meriahhh🎉🎉🎉🤩🤩🤩
semoga tahun depan bisa kesini lagi☺️☺️",5,2025-11-15
Kampung Cireundeu,Tempat nya enak untuk ngadem. Untuk acara group jg bisa.,4,2025-11-12
Kampung Cireundeu,Lokasi tidak terurus .... tidak sesuai ekspetasi,1,2025-10-31
Kampung Cireundeu,Cek,5,2025-10-29
Kampung Cireundeu,"Kampung adat yg unik, bersih, rapih dan asri, bisa menikmati berbagai macam olahan singkong : rasi, combro, keripik dll",5,2025-10-27
Kampung Cireundeu,"Akses mudah, parkir murah dan aman",4,2025-10-11
Kampung Cireundeu,Kampung adat di daerah cimahi. Cocok untuk anak-anak bermain dan menambah pengetahuan tentang adat istiadat sunda,5,2025-10-10
Kampung Cireundeu,"Sudah ke sekian kali nya,tempat na ngeunaheun lah...cuma kemain posisi nya lagi sepi ga ada kegiatan....kalo kesini jangan lupa ngopi banyak makanan yg terbuat dari singkong(itu ciri khas nya)..",5,2025-10-08
Kampung Cireundeu,"Tidak terlalu luas sebagai desa wisata, cukup bersih,",4,2025-09-29
Kampung Cireundeu,mantap,5,2025-09-27
Kampung Cireundeu,"Untuk kunjungan kampung budaya ok sih ini apalagi tar pulangnya bisa bawa oleh2 dr olahan serba singkong lho, unik2 dan rasanya enak",4,2025-09-25
Kampung Cireundeu,"Kesini pas acara kantor, disini kita diajarin budaya sunda, belajar bermain angklung buncis, bikin mie singkong, beras singkong (rasi), juga ada jualan snack2 dari singkong, dendeng kulit singkong dan cireng bumbu rujaknya enak banget. Masakan disini juga enak, chicken katsu, ayam bumbu, soto ayam, enak semua masakannya dipadukan dengan beras singkong.
Sampurasun...Rampes.",5,2025-09-23
Kampung Cireundeu,jalanannya tolong diperbaiki!,3,2025-09-22
Kampung Cireundeu,Sangat luar biasa adat dan alamnya. Makanan yang sangat istimewa bagi saya.,5,2025-09-21
Kampung Cireundeu,"Kampung cirendeu akan di masukkan dalam cagar budaya, dimana di kampung itu yang menjadi bahan makanan pokok adalah olaan singkong, jujur sih, siapa yg gak tau singkong..? Enak. Pas disini jadi lebih wah... Lagi, semuanya beneran dari singkong, kecuali lauk yah. Kue kue dari singkong, oh ya, kalo mau kesini bisa nyoba nasi singkong, di sabtu pagi aja yah. Parkiran...? Ada dan lumayan luas, ke kampung tinggal turun jalan kaki. Gak jauh koq.",5,2025-09-14
Pandiga Educreation Sports,Tempat bagus n bersih pula hanya sayang bangett tempat bilasnya rame rame sedangkan kalo mandi butuh privacy.... Udh gitu kmr mandi rusak udh beberapa kali saya kesana msh keterangan rusak dan maaf mah ada kotorannya.... Hanya itu aja over all bagusss apalgi kolam renangnya bersihh....,3,2025-10-28
Pandiga Educreation Sports,"Tempat berenang di Cimahi yang oke banget. Kolamnya gede dan ada atapnya jadi ga perlu khawatir kena panas matahari. Biasa dipake buat les renang juga, yang privat atau grup. Harga tiket cukup affordable, khusus weekend nambah dikit. Buat yang ga berenang bisa sambil mencicipi kuliner di kafenya ataubduduk-duduk nyaman di area lobinya ditemani kucing-kucing lucu yang berkeliaran 😸",4,2025-10-28
Pandiga Educreation Sports,"Overall is good, tapi lantai kolamnya gaenak karna licin. Kamar mandinya cukup bersih, showernya bareng gitu jadi bilik²nya cm buat ganti baju. Ada air panasnya juga, cukup nyaman.
Yang perlu dipernaiki adalah lokernya, info loker tuh kurang bagus pas udh masuk ternyata sewanya di kasir depan muter lagi. Harusnya kalau cuma sebatas loker bs gratis masuk harga tiket sekalian",5,2025-10-14
Pandiga Educreation Sports,"airnya bersih, mandinya terbuka bareng"", saran saya kamar gantinya di rubah kamar mandi ada krannya, biar nyaman🙏",3,2025-10-13
Pandiga Educreation Sports,"Sudah sering berenang di sini.  Tempatnya nyaman, tidak pernah sampai terlalu ramai. Area kolam standar , cocok untuk bersantai sambil berenang.

Sesekali ke lokasi untuk acara pernikahan kerabat. Konsep resepsinya outdoor namun area yang digunakan untuk tempat prasmanan dan booth makanan sudah diberi atap sehingga aman jika tiba-tiba turun hujan.

Area rumput hijaunya cukup luas untuk tempat pelaminan.",5,2025-10-06
Pandiga Educreation Sports,Makanan nya enak.. Kolam nya bersih,5,2025-10-02
Pandiga Educreation Sports,Tempat parkir luas dan owner nya ramah,5,2025-09-26
Pandiga Educreation Sports,"Main badminton disini, lapang sudah karet harga kompetitif okelah.",5,2025-09-11
Pandiga Educreation Sports,"tempat renang harga terjangkau dengan pelayanan dan fasilitas renang yg bagus dan memadai, tempat duduk cukup banyak, ada smoking area, kolam renang ada 3 dan lumayan besar, tempatnya bersih juga, udah sering renang ke sini dan tiap pesen makanan di sini juga rata2 enak. Kurang di tempat bilasnya aja karena itu tempat bilas yg tipenya bersama, bukan yg masing2 seperti toilet",4,2025-08-28
Pandiga Educreation Sports,"Tempat nya luas, dateng kesini weekday agak siang lumayan ramai. kolam besar untuk dewasa cuma ada 1, untuk anak2 ada 1. tempat duduk ada yg smoking dan non smoking area terpisah.
sayang banget toilet mandi nya tidak per org tapi shower barengan ada ruang ganti baju.

Ada menu cafe harga nya so so.

Harga Tiket masuk
weekday: Rp 30.000
weekend: Rp 35.000

buat daerah cimahi ini termasuk kolam yg oke👍🏻",4,2025-08-25
Pandiga Educreation Sports,"tempat renang semi outdoor kebilangnya, harganya lumayan murah, tempatnya luas, parkirnya juga enak karna luas
kolam renangnya hanya ada 2
yg ukuran anak kecil dan dewasa
airnya ga terlalu banyak kaporit jadi lebih nyaman renangnya, tempatnya estetik juga sihh jadi betah sampe malem 🤣",5,2025-08-18
Pandiga Educreation Sports,"Kolam renang semi indoor yang bagus, cocok sebagai tempat berenang bagi keluarga.",5,2025-08-17
Pandiga Educreation Sports,Americano orangenya seger banget kalo abis renang siang siang,4,2025-08-10
Pandiga Educreation Sports,"Tempatnya terik, cerah ada taman spot nongkrong sama kolam renang yang dingin, pas banget buat rekreasi untuk yang bingung mau kegiatan dimana,makananya untuk nasi goreng enakk banget, nagih,servicenya bagus",5,2025-08-03
Kampung Cireundeu,"Ethics, nature, calm, friendly, warm",5,2025-08-27
Kampung Cireundeu,"Kampung yang resik. Kalo mau belajar tentang budaya sunda bisa kesini, bisa menghubungi warga masyarakat adatnya. Ramah-ramah, bersih, tenang.
Kalo mau hiking ke puncak salam, jangan pakai alas kaki dan jangan pakai baju merah yaa",5,2025-08-15
Kampung Cireundeu,"Cireunde berasal dari nama pohon reundeu, hal ini terjadi karena sebelumnya kampung ini banyak sekali pohon reundeu, atau pohon untuk obat herbal. Masyarakat kampung adat Cireundeu memiliki prinsip Ngindung Ka Waktu, Mibapa Ka Jaman, artinya Ngindung Ka Waktu adalah sebagai warga kampung adat memiliki cara dan ciri masing-masing.",5,2025-08-12
Kampung Cireundeu,"Kampung Adat Cireundeu dan Tradisi Makan Rasi (beras singkong)

Kampung Adat Cireundeu, yang terletak di Leuwigajah, Kota Cimahi, Jawa Barat, merupakan salah satu perwakilan budaya Sunda yang kaya. Salah satu tradisi unik yang masih dipertahankan oleh masyarakat di sini adalah kebiasaan makan singkong yang diolah menjadi beras sebagai pengganti nasi. Tradisi ini tidak hanya mencerminkan kearifan lokal, tetapi juga berfungsi sebagai simbol identitas budaya yang kuat.

Tradisi makan singkong di Kampung Cireundeu berakar dari kondisi geografis dan ekonomi masyarakat setempat. Di masa lalu, singkong menjadi salah satu sumber pangan utama karena lebih mudah ditanam dan dirawat dibandingkan padi. Masyarakat percaya bahwa singkong memiliki kekuatan gizi yang cukup untuk mempertahankan stamina dan kesehatan.

Singkong biasanya disajikan dengan cara dijadikan beras dengan proses yang akan diajarkan ketika Kita berkunjung. Masyarakat Cireundeu juga mengolah pati singkong dan kulit singkong menjadi berbagai makanan, seperti:
- cireng goreng aneka rasa
- eggroll aneka rasa
- peyek singkong
- dendeng kulit singkong
- dll

Kebiasaan makan singkong ini berpengaruh positif terhadap pola makan masyarakat. Selain menjadi alternatif murah dan bergizi, singkong juga memberikan rasa kenyang yang tahan lama. Di samping itu, tradisi ini memperkuat identitas budaya dan rasa kebersamaan di kalangan warga.

Kampung Adat Cireundeu adalah contoh nyata dari pelestarian budaya melalui tradisi makan singkong. Kebiasaan ini tidak hanya mencerminkan kearifan lokal, tetapi juga menjadi simbol ketahanan pangan dan kreativitas masyarakat dalam menghadapi tantangan zaman. Dengan melestarikan tradisi ini, Cireundeu menunjukkan bahwa makanan bukan hanya sekadar konsumsi, tetapi juga bagian dari identitas dan kebudayaan yang harus dijaga.",5,2025-08-05
Kampung Cireundeu,"MasyaAllah..
Adeummmm bangeeet yaa.. Disini 🍃
Ramah2 🥰 wellcome orang-orang ny 🤗
Cuma sayang toilet ny kurang dijaga kebersihannya 🙏
Oleh2 ny enak semuanya terbuat dr bahan dasar singkong..
Smoga tradisi ny terus terjaga 🤲
Smoga bs berkunjung lg 🫶",5,2025-08-02
Kampung Cireundeu,Suasana perkampungan sunda.,4,2025-07-30
Kampung Cireundeu,adeeemmm serasa di lembur sendiri,5,2025-07-28
