location_name,review_text,rating,review_date
Taman Kartini,Bagus untuk sarana pembelajaran,5,2026-04-27
Taman Kartini,Tempat santai,3,2026-04-09
Taman Kartini,Taman dgn udara sejuk,4,2026-04-07
Taman Kartini,Tempatnya luas utk bermain anak-anak,5,2026-03-23
Taman Kartini,"Tamannya asri dan sejuk dgn beragam mainan anak2 yg murah. Namun sayang kurang terawat, tempanta kotor dan banyak rumput liat serta tanaman besar yg tdk dirawat, membuat kesan gelap dan seram. Kalau dirawat pasti bagus sekali. Mainannya juga banyak yg rusak dan agak bahaya karna dibuat dari besi yg tajam.",4,2026-03-22
Taman Kartini,"Sekarang dipake dangdutan, maaf ya itu kan lingkungan anak sekolah, yg nyanyi ibu ibu pakaian seksi gual geol sambil merokok apakah bukan sa jadi contoh yg baik buat anak anak.. saya heran kok diizinkan kaya gitu ..",1,2026-03-20
Taman Kartini,Jagalah selalu kebersihan dan ketertiban,5,2026-02-26
Taman Kartini,"Kalau malam banyak tukang jajanan di depan taman, harga merakyat n rasa enak enak",5,2026-02-12
Taman Kartini,Sekarang sudah banyak pedagang kuliner,3,2026-02-08
Taman Kartini,"Perlu dilakukan perawatan dan penanganan Sampah juga penataan pedagang disekitar Taman Kartini.sehingga Taman Kartini akan terlihat asri, juga  bermanfaat sebagai tempat rekreasi Gratis bagi Masyarakat yang tinggal di Cimahi maupun luar Cimahi yang datang berkunjung ke Cimahi,",3,2026-02-06
Taman Kartini,Tempat bermain anak sekaligus tempat kuliner malam hari,5,2025-12-20
Taman Kartini,Awalnya bagus. Lama kelamaan jadi kotor. Kurang nyaman,3,2025-12-16
Taman Kartini,"Padahal enak ngadem disini, ada tempat main anak” juga tapi sayang sekali berisik sama yg karoke jadi kurang nyaman",1,2025-12-06
Taman Kartini,Berisik banget ada yg buka lapak karaoke. Mana yg nyanyi nenek nenek semua,1,2025-12-06
Taman Kartini,Kiw kiw,5,2025-10-16
Taman Kartini,"Sudah terlalu Banyak pedagang ,sudah tidak sesuai peruntukannya, seharusnya diganti dari taman Kartini jadi taman UMKM, pedagangnya berani ngusir pengunjung ,sudah sangat tidak disarankan untuk hanya sekedar berjalan² ditempat ini, banyak oknum yang memanfaatkan tempat ini untuk mencari keuntungan pribadi",1,2025-09-22
Taman Kartini,Tempat nungguin jemputan zaman sd disini,4,2025-09-19
Taman Kartini,"Tempatnya kumuh, kotor dan banyak sampah.. area bermain rusak dan ternyata bayar guysss",3,2025-09-03
Taman Kartini,Ok,3,2025-08-21
Taman Kartini,"taman nya kotor, area bermain  rusak, pdhl klo d perbaiki snagat bermanfaat bagi warga sekitat",2,2025-07-10
Taman Kartini,Beautifull..,5,2025-06-28
Taman Kartini,Tempat sejuk,5,2025-06-25
Taman Kartini,Taman yg cocok utk menikmati sore hari yg teduh,4,2025-06-21
Taman Kartini,Kumuh,3,2025-05-25
Taman Kartini,"Bagus pokonya,,buat ajak jalan jalan anak,,,gratis",5,2025-05-21
Taman Kartini,Taman bermain budget afordable bgt untuk ngajak anak di akhir bulan,5,2025-05-20
Taman Kartini,Taman bwrmain anak ada juga wahana ada,5,2025-05-18
Taman Kartini,"Tempat sejuk, jajanan murah, permainan juga termasuk murah, ada wifi gratis juga

Kalo bisa tempat Di tata lebih baik lagi agar lebih bagus",4,2025-05-17
Taman Kartini,"Beberapa wahana bermain anak tidak terawat dengan baik, kebersihan lingkungan terhadap sampah perlu ditingkatkan",2,2025-05-15
Taman Kartini,Ramai kuliner dan permainan anak2,4,2025-05-15
Taman Kartini,Bagus,4,2025-04-30
Taman Kartini,Lumayan buang penat.. tempat sejuk ditengah kota..,5,2025-04-20
Taman Kartini,Sederhana lumayan untuk tempat istirahat,4,2025-04-17
Taman Kartini,"Masih kayak dulu, dengan sedikit penataan namun hasilnya masih kurang mewakili unt disebut taman kota. Tak lebih hanya seperti tempat parkir saja.",3,2025-04-16
Taman Kartini,"Perlu banyak perbaikan terutama area skateboard karena tidak terawat. Namun, cukup oke buat sekadar melepas penat, ada mainan anak-anak, persewaan mainan, karaoke jalanan, dan jajanan.",3,2025-04-15
Taman Kartini,Taman yg bagus,5,2025-03-25
Taman Kartini,Bisa buat nyantai bareng keluarga dan ada banyak makanan.,5,2025-03-08
Taman Kartini,nyaman,5,2025-02-16
Taman Kartini,"Sering liwat dan belum sempat eksplore, hanya liwat aja",5,2025-02-15
Taman Kartini,"Semakin waktu taman Kartini berproses menjadi lebih baik, lebih nyaman,",5,2025-01-27
Taman Kartini,Beli kebab falah enak,5,2025-01-21
Taman Kartini,"Tempatnya
banyak sampah ,coba ada petugas kebersihannya",3,2025-01-19
Taman Kartini,adem bangett enak dipake nongki cantik,5,2025-01-16
Taman Kartini,Salah satu spot kuliner dan nongkrong yang lumayan nyaman di Kota Cimahi,5,2025-01-15
Taman Kartini,"Lumayan nyamann sekarng.. Udah ada rumput sintetis.. Dan jajanan enak"" Dan worth it",5,2025-01-14
Taman Alun-Alun Kota Cimahi,Indah enak untuk ambil foto,5,2026-04-21
Taman Alun-Alun Kota Cimahi,Mantap☕.,5,2026-04-21
Taman Alun-Alun Kota Cimahi,rumah deket alun tapi jarang k sini paling klo ad sesuatu penting klo ga ya cuman idul fitri buat solat id,5,2026-04-20
Taman Alun-Alun Kota Cimahi,"Saya pernah berada disini untuk istirahat sejenak saat saya menikmati suasana Kota Cimahi, Jawa Barat. Suasananya cukup ramai, dan tempatnya cukup bersih saat saya berada disana. Lokasi strategis, berada di jantung Kota Cimahi. Cukup banyak warga yang berkunjung disini, untuk menikmati suasana. Mantap 😁👍",5,2026-04-19
Taman Alun-Alun Kota Cimahi,Jual makanan beku dan prozen food,5,2026-04-16
Taman Alun-Alun Kota Cimahi,butuh pemantauan kebersihan dan pemeliharaan,3,2026-04-10
Taman Alun-Alun Kota Cimahi,Tempat nongkrong anak2,5,2026-04-09
Taman Kartini,mantul,5,2025-01-04
Taman Kartini,Cocok buat pacaran,5,2024-12-24
Taman Kartini,mantaplp,5,2024-12-16
Taman Kartini,"Adem, banyak yg jualan dan tempat anak bermain",4,2024-12-04
Taman Kartini,Taman Kartini adalah sebuah good I love you😘 so I can I have been trying to make sure your friends and the first🥇 day😊 and the first day😊 and the other side,5,2024-11-28
Taman Kartini,Tempat bermain,5,2024-11-23
Taman Kartini,"huhuu sedih banget smlm kesini baru kali ini ilang helm biasanya g pernh bilang tiap main kesini tp smlm lg apes kali ya jd hlm ku ilangg, buat tmn tmn yg mau kesini hlm hrap di bawa tkt ada yg ngmbil ky ak🥲🥲",3,2024-11-17
Taman Kartini,"Tempat ok buat santai banyak kuliner, sayangnya malam semuanya tutup",5,2024-11-16
Taman Kartini,"Sekarang kalo mau pilih2 jajanan malem sekitar Cimahi ksini aja . Dari mulai es coklat yg enak , dimsum mentai yg enak dan murah , pecel lele enak , persambal Bakaran yg pedesnya jos gandosss , jagung bakar serut pedas manis yg aku sukaaa , wedang ronde yg enak murah dan fillingnya pullll banget .. ahh suka pokoknya .  Mainan2 anak kecil juga banyak , siapin tissue basah aja supaya tangannya ga kotor . Siapin recehan juga Krn  pengamennya pas kita lagi makan jumlah nya nyaingin tent yg jualan hehe",5,2024-11-09
Taman Kartini,Cukup bikin anak seneng👍,4,2024-11-08
Taman Kartini,banyak tmpt jajan yg enak,5,2024-11-05
Taman Kartini,Masih byk yg harus diperbaiki,4,2024-11-02
Taman Alun-Alun Kota Cimahi,bagus banget sekarang alun alun cimohai wkkwkw,5,2026-03-31
Taman Alun-Alun Kota Cimahi,Tempat ini selalu saya jadikan patokan untuk cod hp. Aman dan nyaman.,5,2026-03-30
Taman Alun-Alun Kota Cimahi,Nganter anak beli jaket cenah.....  😎,5,2026-03-26
Taman Alun-Alun Kota Cimahi,"Nyamn Cocok buat anak ,,smoga bisa kebali kesini,,,",5,2026-03-26
Taman Alun-Alun Kota Cimahi,"Sering ke sini dari tahun 2005an sampe skrg. Jujur lebih suka alun2 sebelum dirombak seperti sekarang. Memang lebih modern dan dilengkapi playground juga utk anak2. Tapi sayang sekali beberapa pohon besar ditebang, apalagi yg area sekitar toko perlengkapan pramuka itu padahal banyak pohon2 dan sejuk buat nongkrong dan menenangkan pikiran. Kadang masih ada pengamen dan peminta2 yang agak mengganggu. Pengunjung rata2 masih blm sadar kebersihan sehingga kadang terkesan kurang bersih. Suka ada yg tidur2 di kursi juga jadi kagok mau duduk2 di sekitar sini.",4,2026-03-26
Taman Alun-Alun Kota Cimahi,Tempat nya bagus bisa di pakai buat istirahat,4,2026-03-23
Taman Alun-Alun Kota Cimahi,luas,5,2026-03-23
Taman Alun-Alun Kota Cimahi,"Rame banget sekarang
Banyak makanan",4,2026-03-20
Taman Kartini,"Suasana tempat sangat sejuk dan nyaman untuk keluarga untuk nongkrong sama teman,  ngopi bareng melamun 😁",5,2024-10-20
Taman Kartini,"Tempat luas, bersih, pelayanan ramah",5,2024-10-16
Taman Kartini,"Bagus, untuk wahana bermain anak2",5,2024-10-13
Taman Kartini,"Pelayanannya ramah, tempatnya nyaman, prosesnya mudah dan cepat",5,2024-10-08
Taman Kartini,Taman nya udah mulai oke sih sekarang,5,2024-10-07
Taman Kartini,Cocok bawa anak,5,2024-10-06
Taman Kartini,enak yaa batagor bandung tuh,4,2024-10-03
Taman Kartini,Tempat nya nyaman,5,2024-10-01
Taman Kartini,"Malem2 nyobain makanan di pinggir jalan taman kartini , aku nyobain stik ayam bbq harganya 20 rb luamyan ya tapi saos bbq nya asem kaya bolognise rasanya dan suami ku pesan paket ayam bakar hargnya 25rb rasanya B saja (balik lagi ke selera masing2 ya ) tapi masih ok lah . Terima kasih",4,2024-09-29
Taman Kartini,"Mushola dan kamar mandinya juga ada, mantap",5,2024-09-27
Taman Kartini,"Taman sudah jauh lebih bersih, nyaman dan tempat nongrong murmer",5,2024-09-24
Alam Wisata Cimahi,Tempatnya adem banget,5,2026-04-21
Alam Wisata Cimahi,Good,5,2026-04-16
Alam Wisata Cimahi,Lumayan juga untuk nikahan alamnya luas.... Hits ok. 👍,5,2026-04-12
Alam Wisata Cimahi,"Adem, fasilitas lengkap, harga bersahabat",5,2026-04-09
Alam Wisata Cimahi,Indaj dan seru,5,2026-04-08
Alam Wisata Cimahi,"Wisatanya sedikit ya lebih ke kafe dan tidak begitu luas.
Tolong fasilitas anak"" di perbaiki dan di bikin bagus lgh.
Kolam renang pemandangan oke banget
Rusa nya cuma 2, februari 2026",4,2026-04-08
Alam Wisata Cimahi,Bagus,5,2026-04-06
Alam Wisata Cimahi,Good place,5,2026-03-26
Taman Kartini,"Dateng kesini jam 8:30 malam. Kondisi masih ramai. Ada area bermain anak, lapangan skateboard, wc umum dll. Banyak juga yg jualan.",5,2024-09-17
Taman Kartini,Sekarang udah ga kumuh lagi banyak permainan dan kuliner,5,2024-09-16
Taman Kartini,Banyak tenda makan dengan nyaman tapi tetap hemat,5,2024-09-14
Taman Kartini,Rapih dan ramai,5,2024-08-28
Taman Kartini,tempatnya sejuk,5,2024-08-27
Taman Kartini,"Sy dulu waktu sekolah d STM PEMBANGUNAN leuwigajah sering nongkrong d taman kartini..sekitar tahun 89 dan cukup bagus..apalagi sekrang tambah bagus nyaman cocok untuk semua kalangan dan tdk lp kuliner nya ok banget..pesen jaga kebersihan dan kerapihan nya, buang sampah pd tempat nya.",5,2024-08-20
Taman Alun-Alun Kota Cimahi,bangkrut loh,1,2026-03-18
Taman Alun-Alun Kota Cimahi,Lumayan tempatnya sayang banyak.pengamen ngak jelas lagu nya hanya modus saja,5,2026-03-16
Taman Alun-Alun Kota Cimahi,"korupsi harga parkir yang harusnya 2k dicoret jadi 4k, ada gila gilanya",1,2026-03-16
Taman Alun-Alun Kota Cimahi,"Makin sini lumayan terawat, kalau bisa disediakan parkiran khusus yang mudah diakses dari jalan raya, karena masih banyak parkir liar",5,2026-03-15
Taman Alun-Alun Kota Cimahi,"Udh ada basement tapi parkir masih di nggir jalan raya, hal spele gak bisa dibenerin? Sangat mengganggu estetika perkotaan apa lg yg pinggir jln raya🤣  selebihnya good sih.",4,2026-03-12
Taman Alun-Alun Kota Cimahi,Tempat transit sekaligus tempat ngadem sejenak,5,2026-03-08
Taman Alun-Alun Kota Cimahi,Selalu jadi pilihan pertama,5,2026-03-01
Taman Alun-Alun Kota Cimahi,Ok,5,2026-03-01
Taman Alun-Alun Kota Cimahi,"Masjid besar cimahi, kenyamanan yg sangat nyaman dan sejuk. WCnya pun bersih",5,2026-02-26
Alam Wisata Cimahi,Makanannya enak untuk kebersihan tempatnya lebih di perhatikan karena sekarang tempat makan sudah banyak,5,2026-03-26
Alam Wisata Cimahi,"Suasana nya enak buat liburan,makanan nya pun lumayan enak-enak.",5,2026-03-14
Alam Wisata Cimahi,Venue Rekomendasi buat wedding dan acara lainnya,5,2026-03-12
Alam Wisata Cimahi,"Saya mengadakan acara tunangan disitu tgl 4 mei tahun lalu, cuma menunya kurang bervariasi hanya ada 3 pilihan paket saja, dan minusnya lagi gak ada villa disitu atau seperti penginapan supaya kalau ada pernikahan, pengantin bisa nginep disitu supaya tidak jauh dari area venue. Coba lebih dikembangkan lagi deh pasti rame dan lebih banyak lagi yg buat event disitu. Menu pilihannya lebih banyak lagi, ada penginapan tapi kaya glamping aja.",4,2026-03-11
Alam Wisata Cimahi,"Tempatnya luas bagus untuk acara
Sepertinya suasanq malam akan lebih indah",5,2026-03-10
Alam Wisata Cimahi,Tempat Nyaman...,5,2026-03-04
Alam Wisata Cimahi,"Beberapa tahun sebelumnya, tempat wisata ini saya yakin lebih ramai, di awal tahun 2026, tinggal ada spot rusa saja yg ada. Padahal kalau ditata kembali akan jadi wisata alam yg menarik sebab tempatnya sejuk dan asri. Kolam renang ada, mushala ada, tempat parkir pun luas.",4,2026-03-01
Alam Wisata Cimahi,Pertama x kesini cos acara arisan lumayan tempatnya adem,5,2026-01-25
Alam Wisata Cimahi,Tempat luas nyaman...buat event ok dsini,5,2026-01-17
Taman Kartini,Lumayan untuk taman bermain,4,2024-08-13
Taman Kartini,Banyak stand makanann sekarang mah,4,2024-08-13
Taman Kartini,Sangat enak sekali.. Mantap pokoke yah,5,2024-08-13
Taman Kartini,Enak buat tempat santai keluarga,4,2024-08-12
Taman Kartini,Tempat bermain anak anak dan kuliner.,5,2024-08-11
Taman Kartini,Sederhana dalam bagus banget,5,2024-08-07
Taman Kartini,"Tempatnya nyaman
Kuliner malam disini disajikan makanan/minuman murah meriah",5,2024-08-04
Taman Kartini,"Taman Kartini di desain oleh pemerintah Hindia Belanda sebenarnya untuk penghijauan kota, bukan secara spesifik untuk lokasi taman wisata.
Mengingat lokasinya yang kurang luas namun bermanfaat untuk penghijauan kota Cimahi.
Seiring perkembangan maka pemerintah kota Cimahi mengembangkannya dan memanfaatkannya bagi umum untuk berwisata.
Butuh pengelolaan dengan manajemen yang baik.",3,2024-08-02
Taman Kartini,"Taman kartini sekarang sudah sangat berbeda dari pada tahun tahun kemarin. Tempatnya jauh lebih nyaman, bersih dan di rawat dengan baik. Kalau kesini rekomendasi malam malam soalnya banyak kuliner dengan harga yang cukup murah dengan banyak makanan yang bisa dipilih.",5,2024-07-26
Alam Wisata Cimahi,Penuh nostalgia,5,2026-01-06
Alam Wisata Cimahi,"Seru nyaman, murmer",5,2026-01-02
Alam Wisata Cimahi,Tempatnya sejuk dan nyamam,5,2026-01-02
Alam Wisata Cimahi,"Pengalaman yang bagus buat jalan bersama keluarga sudah ada resto, kolam renang, kebun binatang mini, playground. Kurang nya cuma satu banyak wahana nya yang gak terawat.",5,2026-01-01
Alam Wisata Cimahi,"Tempat bagus, nyaman, untuk acara nikahan juga enakeun , parkir luas",5,2025-12-31
Alam Wisata Cimahi,"Tempatnya lumayan, minumannya enak",5,2025-12-31
Alam Wisata Cimahi,"Tempat nya Bagus dan Luas, Parkiran Mobil Lega dan Suasana Sejuk nan Asri",5,2025-12-29
Alam Wisata Cimahi,"Tempat bermain nya sangat banyak, hanya perlu perawatan saja, ayo semangat team AWC agar menjadi tempat wisata yang lebih menarik, terima kasih",5,2025-12-28
Alam Wisata Cimahi,👍👍👍👍👍👍,5,2025-12-28
Alam Wisata Cimahi,Panassss,4,2025-12-23
Alam Wisata Cimahi,CAKEP,5,2025-12-19
Alam Wisata Cimahi,"Alam Wisata Cimahi merupakan tempat yang cocok untuk healing bersama keluarga. Tempat nya luas, bersih, dan asri. Suasana nya nyaman dan sejuk. Ada tempat untuk outbond dan camping. Ada mini zoo, kolam renang, dan playground anak. Fasilitas nya pun sudah lengkap dari mulai musholla, tempat makan, dan toilet...",5,2025-12-11
Alam Wisata Cimahi,Tempatnya sejuk enak utk acara,5,2025-12-10
Alam Wisata Cimahi,Aku sering menggunakan tempat ini baik hadir dlm undangan ataupun membawa rombongan. Tempatnya: dekat ke pusat kota cimahi. bisa untuk acara pernikahan. seminar atauoun rekreasi. makannya terjangkau.,4,2025-12-09
Alam Wisata Cimahi,Biasa aja..,3,2025-12-04
Alam Wisata Cimahi,Keren tempatnya.... Two thumb... Plus makanannnya... Luar biasa,5,2025-11-11
Alam Wisata Cimahi,maba politeknik piksi Ganesha,5,2025-11-08
Alam Wisata Cimahi,Semoga ke depannya makin tertata dan musholanya bisa lebih memadai dan lebih harum,3,2025-10-29
Alam Wisata Cimahi,Tempatnya nyaman,5,2025-10-18
Alam Wisata Cimahi,👍👍👍👍👍,5,2025-09-26
Taman Kartini,Tmpat yg bagus buat bermain anak kcil,4,2024-07-22
Taman Kartini,"Cukup tenang untuk menikmati kesendirian ,, untuk yg punya anak ada beberapa permainan yg bisa di mainkan",3,2024-07-18
Taman Kartini,"Kuliner malam, banyak makanan. Ada Es Coklat DikalaSenja yang enak banget, harganya jg pas di kantong dgn rasa  premium. Balik lg sihhhh",5,2024-07-14
Taman Kartini,"Tempat rekreasi untuk anak""murah meriah dan cukup nyaman",1,2024-07-11
Taman Kartini,Sekarang sudah nyaman,4,2024-07-10
Taman Kartini,"Ramai yg dagang, dan sewa mainan bikin anak malah rewel",2,2024-07-09
Taman Kartini,Enak buat tempat nongkrong,5,2024-07-08
Alam Wisata Cimahi,Suasananya enak.. makanannya enak,5,2025-09-16
Alam Wisata Cimahi,Rekomen untuk wisata alam tidak jauh dari kota,5,2025-09-08
Alam Wisata Cimahi,Tempat nya enak dan bersih sejuk nyaman buat liburan keluarga dan bisa buat acara umum seperti weding pernikahan,5,2025-09-03
Alam Wisata Cimahi,"Lokasi strategis, adem nyaman utk refresing dg keluarga atau acara2 fun game",5,2025-08-26
Alam Wisata Cimahi,Great place for wedding reception,5,2025-08-14
Alam Wisata Cimahi,"Wisata kuliner dengan nuansa teduh, nyaman, dan aman. Spot2 photo. Mini zoo. Wahana2 bermain . Ada kolam renang. Menunya byk pikihan harga terjangkau. Lokasi makan ada bbrp pilihan. Kalo malam konsep nya jadi citilight. Cantik banget. Cimahi punya.",5,2025-07-27
Alam Wisata Cimahi,"Ada sekitar 3 gedung yang di sewakan untuk pesta, ada cafe dengan makanan khas sunda, tempat dengan lumayan luas pasilitas nya dengan kebun binatang mini, Playground, kolam renang, dan outbond,",5,2025-07-25
Alam Wisata Cimahi,Pajak makanannya wow banget,3,2025-07-25
Alam Wisata Cimahi,Makanan Lumayan rasanya tempat ok,4,2025-07-16
Taman Alun-Alun Kota Cimahi,Terbaik pokoknya salah satu taman yang ada dikota cimahi cukup bersih dan rapih,5,2026-02-16
Taman Alun-Alun Kota Cimahi,Mantap,4,2026-02-16
Taman Alun-Alun Kota Cimahi,Kurang terawat si,4,2026-02-16
Taman Alun-Alun Kota Cimahi,Te langkung bapa,5,2026-02-07
Taman Alun-Alun Kota Cimahi,Ok,5,2026-02-02
Taman Alun-Alun Kota Cimahi,Terima pesanan keripik pisang kg/kemasan,4,2026-01-29
Taman Alun-Alun Kota Cimahi,Sayah tiap lewat ke alaun alaun cimahai suka istirahan sbentar ngopi atau beribadah  di mesjid,5,2026-01-28
Taman Alun-Alun Kota Cimahi,Sangat bagus dan membuatku bahagia,5,2026-01-24
Alam Wisata Cimahi,"Cukup asik buat ajak anak main 💕
Di sisi bawah kiri ada ala-ala skybridge,
Tangkap ikan, ATV, Permainan tembak dan panahan, dan flying fox.

Sisi kanan ada kandang rusa.

Ada kolam renang dgn pemandangan yg baguus, next time mau coba berenang disini.

Ada resto dan bisa disewa buat wedding atau acara lainnya.

Ada glampingnya juga ternyataa!

Dan ada cafe yg aesthetic, menunya beragam dan menarik, ada paketan bbq juga 💕

Gak lama sih disini, cuma buat nemenin anak lari-lari, liat pemandangan, syukurnya ada rusa dan angsa jd makin menarik buat toddler.

Oiya ada outdoor playgroundnya juga. Restonya pake saung-saung asik buat makan bareng keluarga.",5,2025-07-15
Alam Wisata Cimahi,"Hanya perlu lebih hijau lagi, makanan sunda nya enak",5,2025-07-13
Alam Wisata Cimahi,seru untuk wisata bersama keluarga dan grup komunitas,4,2025-07-12
Alam Wisata Cimahi,"Bersih,adem..sejuk luas,, makanan nya enak..kolam renangnya bersih .aku joging pagi disana asyik banget.. pokoknya awc best🥰👌",5,2025-07-11
Alam Wisata Cimahi,Masuk parkir 5rb setiap permainan bayar 15 sampe 35rb,4,2025-07-11
Alam Wisata Cimahi,Alam yang indah untuk menikmati...,4,2025-07-06
Alam Wisata Cimahi,"Buka bersama keluarga 2024
Sepertinya selesai hujan jadi jalannya masih becek. Kami order paket timbel, sate, gorengan, ikan gurame dan beberapa minuman. Terhitung per orang 100rb an, karena tidak habis semua bisa minta di bungkus.",4,2025-07-05
Alam Wisata Cimahi,Tempatnya menarik dan banyak pohon pohon jadi lebih Asri. Ada kolam renang dan penangkaran rusa juga pokoknya bagus,5,2025-07-04
Alam Wisata Cimahi,The air is very clear and fresh,5,2025-06-29
Alam Wisata Cimahi,"Tempat sejuk,nyaman sekuriti ada",5,2025-06-19
Alam Wisata Cimahi,Tempat luas namun kurang terawat,3,2025-06-09
Alam Wisata Cimahi,beautiful views,5,2025-06-01
Alam Wisata Cimahi,Cukup memuaskan dari suasananya pelayananya menunya dan keramahan karyawannya,5,2025-05-18
Alam Wisata Cimahi,"Mantap pelayanannya bagus.. Cuman toiletnya agak remang"" kurang terang 😅",4,2025-05-18
Alam Wisata Cimahi,Sejukkkknyooooooo,5,2025-05-18
Alam Wisata Cimahi,Tempat nikahan yg bagus,5,2025-05-10
Alam Wisata Cimahi,"Buat adm, kalau ada yang hajatan jangan bersebelahan, jadi hampir salah masuk, ditambah suara musik tumpang tindih",4,2025-04-26
Alam Wisata Cimahi,Tempatnya cukup bagus dan nyaman,5,2025-04-21
Alam Wisata Cimahi,Suasana tenang saat berada di sini,5,2025-04-17
Alam Wisata Cimahi,"Tempat ny nyaman, bersih, cocok untuk kumpul keluarga, banyak tempat foto yg Instragramable, tapi aku gk foto karna lgi sibuk",5,2025-04-16
Alam Wisata Cimahi,"Wisata murah meriah dekat ke Cimahi atau Bandung Barat, wahana nya cukup banyak, bisa berkuda, flying fox, arena ATV, memanah, kolam renang dan masih banyak lagi. Cafe dan restonya juga oke, harga standar menu lengkap dan view nya cakeepp lah jangan ditanya. Sering dipakai buat acara nikahan, family gathering sama event"" lain juga. Minusnya kalau ambil hari biasa kadang gaada operator wahana nya, jadi bingung ini buka atau tutup. Overall seru sih ajak main keluarga disini",5,2025-04-06
Alam Wisata Cimahi,Old vibes,3,2025-04-05
Alam Wisata Cimahi,BUNGA RENDAH,5,2025-04-05
Alam Wisata Cimahi,Tmpt yg nyaman enak luas untuk acara khususnya aman bawa anak²,5,2025-04-05
Alam Wisata Cimahi,"Sejuk, citylight juga... Untuk restonya sih oke tapi wisatanya kek kurang terurus.",4,2025-03-31
Alam Wisata Cimahi,Suasana indah,5,2025-03-21
Alam Wisata Cimahi,Utk tempat healing yg deket cimahi,5,2025-03-07
Alam Wisata Cimahi,parkiran cukup luas,4,2025-02-28
Alam Wisata Cimahi,Bagus tempatny cocok untuk acara gathering ato acara keluarga,5,2025-02-19
Alam Wisata Cimahi,HTM free...asal beli makan +minum disini ajah...suasana santai,5,2025-02-17
Alam Wisata Cimahi,First time ktmu calon suami wkwk,5,2025-02-12
Alam Wisata Cimahi,Tempatnya luas,5,2025-02-06
Alam Wisata Cimahi,Membantu Dan Melayani Calon Tamu Alloh Adalah Ibadah Yang Sangat Mulia... Semoga Selalu Bisa dan Terus Amanah,5,2025-02-02
Alam Wisata Cimahi,Sejuk dan banyak fasilitasnya,5,2025-01-17
Alam Wisata Cimahi,"View nya bagus,
Nasi liwetnya rekomend 👍",5,2024-12-31
Alam Wisata Cimahi,"Tempat nya bagus, hanya karena sdah ada berapa yg gak aktif",5,2024-12-29
Alam Wisata Cimahi,Tempatnya lumayan enak untuk nongkrong sambil menikmati pemandangan,5,2024-12-17
Alam Wisata Cimahi,Enak lumayan,4,2024-12-10
Alam Wisata Cimahi,"Pemandangan ny bagus security ny ramah"" pelayanan bagus 👍👍👍",5,2024-12-08
Alam Wisata Cimahi,Bagus,5,2024-12-03
Alam Wisata Cimahi,Good job tempaat yg nyaman buat ajak keluarga,5,2024-11-27
Taman EcoWisata Cimenteng,SAE pokona,4,2026-04-26
Taman EcoWisata Cimenteng,"Udaranya sejuk segar asri.,.",4,2026-04-19
Taman EcoWisata Cimenteng,Ramai d hari minggu suka ada bazar nya,4,2026-03-31
Taman EcoWisata Cimenteng,dulu ada warung skrg gak ada jadi gak bisa jajan,4,2026-01-26
Taman EcoWisata Cimenteng,"Tempatnya enak bisa dibuat tema garden party buat yg mau wedding dsni. Buat nongkrong juga enak. Jauh dri kebisingan kota, minusnya akses jalan ke tempat yg agak sempit aja sih",5,2026-01-09
Taman EcoWisata Cimenteng,"Tempat Olah raga
Bisa botram, reunian atau ngumpul teman""
Ada tempat campingnya biasa buat anak"" sekolah
Ada jajanan tradisional di pasar awi biasanya di hari minggu
Jangan lupa...jaga kebersihan ,ya",5,2026-01-04
Taman EcoWisata Cimenteng,"Enak, adem, sejuk angin sepoi2, jajananya enak2, live musik Sunda",5,2025-12-14
Taman EcoWisata Cimenteng,"Biasanya kesini hr biasa niis kitu tah, tp bru taw klo tiap 2minggu ada pasar awi camperenik beh KALAP lah guateh JAJAN",5,2025-12-10
Taman EcoWisata Cimenteng,Hutan kota cimahi sangat bagus buat wisata dekat rumah,5,2025-12-09
Alam Wisata Cimahi,"Lokasi strategis hanya beberapa menit dari pusat kota Cimahi, walaupun pintu masuk utama pada lintasan tanjakan jalur Cimahi-Cisarua tapi tidak menyurutkan pengunjung untuk datang, halaman parkir cukup luas, satpam yang ramah dan view yg cukup bagus...",5,2024-11-24
Alam Wisata Cimahi,"Tempat nyaman ,makanan masih terjangkau dan enak..untuk anak2 ada tempat bermain juga",5,2024-11-17
Alam Wisata Cimahi,"Makanan akan lebih nikmat disajikan dlm kondisi panas,min.hangat🙏",4,2024-11-01
Alam Wisata Cimahi,Tempatnya nyaman,5,2024-10-10
Alam Wisata Cimahi,"Tempat luas, parkir luas, bagus untuk anak-anak outbound, aula buat kumpul luas, suasana adem. Makanan enak. Bagus.",5,2024-10-05
Alam Wisata Cimahi,"Mantap jiwaaa,,",5,2024-10-03
Alam Wisata Cimahi,"Tempatnya asri, tertata cantik, bersih, makanannya enak.",5,2024-10-02
Taman Alun-Alun Kota Cimahi,Tempatnya strategis dan adem untuk kita bersntai,5,2026-01-22
Taman Alun-Alun Kota Cimahi,"Bagu, tempat hening untuk bersantai",5,2026-01-21
Taman Alun-Alun Kota Cimahi,Nyaman n resik,5,2026-01-21
Taman Alun-Alun Kota Cimahi,"ini tempat kok bersih amet, boleh tidur bikin tenda ngk sihh..hehe

#jejakbaba sudh pernah kesini

ig/tiktok/fb :@Jejakbaba",5,2026-01-20
Taman Alun-Alun Kota Cimahi,Tmpt luas ccok untuk istrht perjlnn jauh....,4,2026-01-19
Taman Alun-Alun Kota Cimahi,"1. Tamannya cukup luas
2. Lokasi bersebelahan dengan masjid agung Cimahi
3. Ada area bermain anak walaupun gak terlalu banyak
4. Rumput taman sintetis bnyak yang udah ngelupas",4,2026-01-10
Taman Alun-Alun Kota Cimahi,👍,5,2026-01-04
Taman Alun-Alun Kota Cimahi,terlalu bnyak pengamen,4,2026-01-03
Taman Alun-Alun Kota Cimahi,Sangat rapih,4,2026-01-02
