LOC-123,Museum Pendidikan Nasional UPI,Tempat Belajar,"['Alam', 'Edukasi', 'Kuliner']",0.7941176470588235,34.0,Sangat Positif,-6.8597725,107.5941677,5000.0,15000.0,08:00,15:00,90.0,"Museum Pendidikan Nasional UPI adalah museum lima lantai di kampus UPI Bandung yang melestarikan sejarah pendidikan Indonesia dari masa prasejarah hingga reformasi, serta berfungsi sebagai pusat penelitian.",Per Orang,Tempat edukasi,"Wisata, Umum, Menarik",08:00,15:00,Tutup,Tutup,internet_research_verified,upi.edu (situs resmi museum),filled_from_reliable_source,seasonal_or_uncertain,Museum buka weekday (Sen-Jum) 09:00-15:00. Weekend hanya menerima kunjungan dengan reservasi khusus dan biaya tambahan. Jam weekend dikosongkan karena bersyarat.,4.588235294117647,28.0,1.0,Edukasi,Edukasi;Indoor,,Alam;Belanja;Kuliner;Petualangan,1.0,False,,"Edukasi: category=Tempat Belajar (+5) | subcategory keyword: edukasi (+1.2) | description keyword: museum, sejarah (+1.5) || Indoor: category=Tempat Belajar (+2) | description keyword: museum (+0.75) | name keyword: museum (+0.6)","{""Alam"": -2.25, ""Belanja"": -2.0, ""Edukasi"": 9.3, ""Indoor"": 3.35, ""Keluarga"": 1.0, ""Kuliner"": -1.25, ""Sejarah"": 0.75}",auto_rule_v1,reviewed,,,,,Edukasi,Edukasi;Indoor,,Alam;Belanja;Kuliner;Petualangan,keep,active_candidate,True,,"Manual reviewer override 2026-05-26: active; weekday hours summarized as 08:00-15:00. DOCX table notes Mon-Thu 08:00-11:30, 13:00-15:00; Fri 08:00-11:00, 13:00-15:30; Sat-Sun closed. Sources: manual_reviewer_docx_2026-05-26",auto_rule_v1,True,False,True,False,manual_docx_override:active_status:opening_hours,False,False,False,False,False,False,unknown,,True,7.04,,False,0.7941176470588235,tfidf_linearsvc,run_nlp_pipeline_v2,True,True,https://res.cloudinary.com/dnfnyjdmj/image/upload/v1781778648/muterbandung/wisata/LOC-123_main.jpg,https://www.google.com/maps/search/?api=1&query=Museum%20Pendidikan%20Nasional%20Universitas%20Pendidikan%20Indonesia&query_place_id=ChIJq9MNBbnmaC4R2_v1rPo1CbY,,google_maps_extractor_2026_05_19,,Museum Pendidikan Nasional Universitas Pendidikan Indonesia,1.0,manual_override,accepted,Accepted by explicit title override.,Unknown,Unknown
LOC-124,Museum Barli,Tempat Belajar,"['Ramah Anak', 'Spot Foto', 'Edukasi', 'Kuliner', 'Santai/Healing']",0.7777777777777778,9.0,Sangat Positif,-6.8783934,107.5875219,25000.0,25000.0,10:00,17:00,90.0,"Koleksi lukisan & pahatan pribadi karya seniman lokal, serta kafe & restoran trendi.",Per Orang,Tempat edukasi,"Wisata, Umum, Menarik",10:00,17:00,10:00,17:00,internet_research_verified,internet_research_verified,filled_from_reliable_source,general_schedule_used_for_both,Jadwal umum digunakan untuk weekday dan weekend.,4.555555555555555,8.0,1.0,Edukasi,Edukasi,Indoor,Alam;Belanja;Kuliner;Petualangan,0.986,False,,Edukasi: category=Tempat Belajar (+5) | subcategory keyword: edukasi (+1.2) | name keyword: museum (+0.6) || Indoor: category=Tempat Belajar (+2) | name keyword: museum (+0.6),"{""Alam"": -2.5, ""Belanja"": -2.0, ""Edukasi"": 7.8, ""Indoor"": 2.6, ""Keluarga"": 1.0, ""Kuliner"": 1.0, ""Ramah Anak"": 0.25, ""Santai/Healing"": 0.25, ""Spot Foto"": 0.25}",auto_rule_v1,auto_approved,,,,,Edukasi,Edukasi,Indoor,Alam;Belanja;Kuliner;Petualangan,keep,active_candidate,,,,auto_rule_v1,True,False,True,False,,False,False,False,False,False,False,unknown,,True,5.28,,False,0.7777777777777778,tfidf_linearsvc,run_nlp_pipeline_v2,True,True,https://res.cloudinary.com/dnfnyjdmj/image/upload/v1781778649/muterbandung/wisata/LOC-124_main.jpg,https://www.google.com/maps/search/?api=1&query=Museum%20Barli&query_place_id=ChIJu3wt5o_maC4RcGMgJN_0k00,,google_maps_extractor_2026_05_19,,Museum Barli,1.0,exact_normalized_title,accepted,Exact normalized title match.,Unknown,Unknown
LOC-125,Wot Batu,Tempat Seni,"['Alam', 'Spot Foto', 'Edukasi', 'Kuliner', 'Santai/Healing']",0.903846153846154,52.0,Sangat Positif,-6.8585391,107.6366148,50000.0,50000.0,10:00,16:30,90.0,Museum outdoor dengan taman Jepang & patung batu besar di lingkungan tenang.,Per Orang,Instalasi seni,"Edukasi, Sejarah, Budaya, Indoor",Tutup,Tutup,Tutup,Tutup,internet_research_verified,internet_research_verified,filled_from_reliable_source,general_schedule_used_for_both,Jadwal umum digunakan untuk weekday dan weekend.,4.75,49.0,2.0,Budaya,Budaya;Edukasi;Spot Foto,Santai/Healing;Indoor;Outdoor,Alam;Belanja,0.705,False,,"Budaya: category=Tempat Seni (+4) | subcategory keyword: seni (+1.2) | tags keyword: budaya (+1.05) || Edukasi: category=Tempat Seni (+1.5) | tags keyword: edukasi, sejarah (+2.1) | description keyword: museum (+0.75) || Spot Foto: category=Tempat Seni (+2) | old multi_labels=Spot Foto (+1) || Santai/Healing: description keyword: tenang, taman (+1.5) | old multi_labels=Santai/Healing (+1) || Indoor: category=Tempat Seni (+1) | tags keyword: indoor (+1.05) | description keyword: museum (+0.75) || Outdoor: description keyword: outdoor, taman (+1.5)","{""Alam"": -2.25, ""Belanja"": -2.0, ""Budaya"": 6.25, ""Edukasi"": 5.35, ""Indoor"": 2.8, ""Kuliner"": -1.25, ""Outdoor"": 1.5, ""Santai/Healing"": 2.5, ""Sejarah"": 1.05, ""Spot Foto"": 3.0}",auto_rule_v1,auto_approved,,,,,Budaya,Budaya;Edukasi;Spot Foto,Santai/Healing;Indoor;Outdoor,Alam;Belanja,keep,active_candidate,,,,auto_rule_v1,True,False,True,False,,False,False,False,False,False,False,low,,True,7.75,,True,0.903846153846154,tfidf_linearsvc,run_nlp_pipeline_v2,True,True,https://res.cloudinary.com/dnfnyjdmj/image/upload/v1781778650/muterbandung/wisata/LOC-125_main.jpg,https://www.google.com/maps/search/?api=1&query=Wot%20Batu&query_place_id=ChIJfUpUnjvnaC4RvuXJAgevtS8,http://www.wotbatu.id/,google_maps_extractor_2026_05_19,,Wot Batu,1.0,exact_normalized_title,accepted,Exact normalized title match.,Unknown,Unknown
LOC-126,Lawangwangi Creative Space,Tempat Seni,"['Alam', 'Spot Foto', 'Kuliner', 'Santai/Healing']",0.9464285714285714,560.0,Sangat Positif,-6.8476429,107.6275129,25000.0,200000.0,12:00,20:00,90.0,"Galeri seni kontemporer, ruang kreativitas & kafe dengan area duduk indoor/outdoor & pemandangan yang indah.",Per Orang,Ruang kreatif,"Edukasi, Sejarah, Budaya, Indoor",12:00,20:00,10:00,21:00,internet_research_verified,internet_research_verified,filled_from_reliable_source,verified,"Jadwal weekday dan weekend berbeda, keduanya terisi dari sumber.",4.776785714285714,543.0,13.0,Budaya,Budaya;Spot Foto;Edukasi,Santai/Healing;Indoor;Malam,Belanja,0.884,False,,"Budaya: category=Tempat Seni (+4) | tags keyword: budaya (+1.05) | description keyword: seni, galeri (+1.5) || Spot Foto: category=Tempat Seni (+2) | description keyword: pemandangan (+0.75) | old multi_labels=Spot Foto (+1) || Edukasi: category=Tempat Seni (+1.5) | tags keyword: edukasi, sejarah (+2.1) || Santai/Healing: description keyword: pemandangan (+0.75) | old multi_labels=Santai/Healing (+1) || Indoor: category=Tempat Seni (+1) | tags keyword: indoor (+1.05) | description keyword: indoor, galeri (+1.5) || Malam: opening hours support night visit (+1.5)","{""Alam"": -0.75, ""Belanja"": -2.0, ""Budaya"": 6.55, ""Edukasi"": 3.6, ""Indoor"": 3.55, ""Kuliner"": 0.25, ""Malam"": 1.5, ""Outdoor"": 0.75, ""Santai/Healing"": 1.75, ""Sejarah"": 1.05, ""Spot Foto"": 3.75}",auto_rule_v1,auto_approved,,,,,Budaya,Budaya;Spot Foto;Edukasi,Santai/Healing;Indoor;Malam,Belanja,keep,active_candidate,,,,auto_rule_v1,True,True,True,False,,False,False,False,False,False,False,unknown,,True,8.55,,False,0.9464285714285714,tfidf_linearsvc,run_nlp_pipeline_v2,True,True,https://res.cloudinary.com/dnfnyjdmj/image/upload/v1781778652/muterbandung/wisata/LOC-126_main.jpg,https://www.google.com/maps/search/?api=1&query=Lawangwangi%20Creative%20Space&query_place_id=ChIJQ6CsgSznaC4RN_gMkXSo6Gw,https://www.artsociates.com/,google_maps_extractor_2026_05_19,,Lawangwangi Creative Space,1.0,exact_normalized_title,accepted,Exact normalized title match.,Unknown,Unknown
LOC-127,Sarae Hills,Rekreasi Keluarga,"['Alam', 'Ramah Anak', 'Spot Foto', 'Kuliner']",0.5,46.0,Positif,-6.8436646,107.6242395,35000.0,35000.0,08:00,18:00,180.0,Sarae Hills di Lembang adalah destinasi wisata bertema keliling dunia yang menampilkan replika bangunan ikonik internasional seperti Menara Eiffel dan Sphinx dengan kafe panorama perbukitan.,Per Orang,Taman rekreasi tematik,"Keluarga, Anak-anak, Wahana, Seru",09:00,17:00,09:00,18:00,internet_research_verified,internet_research_verified,filled_from_reliable_source,verified,"Jadwal weekday dan weekend berbeda, keduanya terisi dari sumber.",4.021739130434782,33.0,10.0,Keluarga,Keluarga;Kuliner;Alam,Ramah Anak;Spot Foto,Belanja,1.0,False,,"Keluarga: category=Rekreasi Keluarga (+4.5) | tags keyword: keluarga, anak, anak-anak, wahana (+4.2) || Kuliner: description keyword: kafe (+0.75) | old multi_labels=Kuliner (+1) | family attraction with explicit culinary evidence (+2.5) || Alam: description keyword: panorama (+0.75) | old multi_labels=Alam (+1) | family attraction with explicit nature evidence (+2) || Ramah Anak: category=Rekreasi Keluarga (+2.5) | tags keyword: anak, anak-anak (+2.1) | old multi_labels=Ramah Anak (+1) || Spot Foto: description keyword: panorama, ikonik (+1.5) | old multi_labels=Spot Foto (+1)","{""Alam"": 3.75, ""Belanja"": -2.0, ""Keluarga"": 8.7, ""Kuliner"": 4.25, ""Outdoor"": 1.2, ""Ramah Anak"": 5.6, ""Santai/Healing"": 1.2, ""Spot Foto"": 2.5}",auto_rule_v1,auto_approved,,,,,Keluarga,Keluarga;Kuliner;Alam,Ramah Anak;Spot Foto,Belanja,keep,active_candidate,,,"Updated master status/facility 2026-05-27; facility_status=lengkap; facility_evidence=ringkasan_agent_belum_url_per_baris; facilities=Area Parkir, Toilet, Mushola, Shuttle Car, Spot Foto Landmark Dunia, Cafe & Resto; action=ready_sebagai_data_awal_fasilitas_umum; note=Diisi dari ringkasan fasilitas yang diberikan user/AI agent: Area Parkir, Toilet, Mushola, Shuttle Car, Spot Foto Landmark Dunia, Cafe & Resto. Kolom kursi roda dan pet friendly tetap ? jika tidak disebut eksplisit.; revision=Sebelumnya kosong total, kini fasilitas utama sudah terisi.",auto_rule_v1,True,False,False,True,updated_master_status_facility_2026-05-27:facility,True,False,True,True,False,False,unknown,,True,8.89,,True,0.5,tfidf_linearsvc,run_nlp_pipeline_v2,True,True,https://res.cloudinary.com/dnfnyjdmj/image/upload/v1781778653/muterbandung/wisata/LOC-127_main.jpg,https://www.google.com/maps/search/?api=1&query=Sarae%20Hills&query_place_id=ChIJcV52mNXgaC4RS4T6WU1owQ8,http://saraehills.com/,google_maps_extractor_2026_05_19,,Sarae Hills,1.0,exact_normalized_title,accepted,Exact normalized title match.,Unknown,Unknown
LOC-128,Observatorium Bosscha,Tempat Belajar,"['Alam', 'Ramah Anak', 'Edukasi', 'Santai/Healing', 'Wahana Ekstrem']",0.9074074074074074,54.0,Sangat Positif,-6.8244765,107.61602,50000.0,50000.0,08:00,17:00,90.0,"Observatorium Bosscha adalah observatorium astronomi tertua dan terbesar di Indonesia yang dikelola ITB di Lembang, memiliki teleskop Zeiss ikonik dan berstatus cagar budaya nasional sejak 2004.",Per Orang,Observatorium,"Wisata, Umum, Menarik",09:00,14:00,09:00,14:00,internet_research_verified,internet_research_verified,filled_from_reliable_source,general_schedule_used_for_both,Jadwal umum digunakan untuk weekday dan weekend.,4.833333333333333,51.0,2.0,Edukasi,Edukasi,Indoor,Alam;Belanja;Kuliner;Petualangan,1.0,False,,Edukasi: category=Tempat Belajar (+5) | subcategory keyword: observatorium (+1.2) | description keyword: observatorium (+0.75) || Indoor: category=Tempat Belajar (+2),"{""Alam"": -2.25, ""Belanja"": -2.0, ""Budaya"": 0.75, ""Edukasi"": 8.55, ""Indoor"": 2.0, ""Keluarga"": 1.0, ""Kuliner"": -1.5, ""Petualangan"": 0.25, ""Ramah Anak"": 0.25, ""Santai/Healing"": 0.25, ""Spot Foto"": 0.75}",auto_rule_v1,auto_approved,,,,,Edukasi,Edukasi,Indoor,Alam;Belanja;Kuliner;Petualangan,keep,active_candidate,,,,auto_rule_v1,True,False,True,False,,False,False,False,False,False,False,unknown,,True,10.86,,False,0.9074074074074074,tfidf_linearsvc,run_nlp_pipeline_v2,True,True,https://res.cloudinary.com/dnfnyjdmj/image/upload/v1781778654/muterbandung/wisata/LOC-128_main.jpg,https://www.google.com/maps/search/?api=1&query=Bosscha&query_place_id=ChIJg9uwkhLhaC4R_T9eA-4-98A,https://bosscha.itb.ac.id/,google_maps_extractor_2026_05_19,,Bosscha,1.0,manual_override,accepted,Accepted by explicit title override.,Unknown,Unknown
LOC-129,Curug Dago,Wisata Alam,"['Alam', 'Spot Foto', 'Edukasi', 'Kuliner', 'Santai/Healing']",0.8823529411764706,51.0,Sangat Positif,-6.8654924,107.6181817,15000.0,15000.0,07:00,17:00,120.0,Curug Dago adalah air terjun setinggi 12 meter dari aliran Sungai Cikapundung di kawasan Tahura Djuanda yang menyimpan dua prasasti bersejarah peninggalan Raja Thailand abad ke-19.,Per Orang,Daya tarik alam,"Alam, Outdoor, Pemandangan, Udara Segar",08:00,17:00,08:00,17:00,internet_research_verified,internet_research_verified,filled_from_reliable_source,general_schedule_used_for_both,Jadwal umum digunakan untuk weekday dan weekend.,4.509803921568627,46.0,1.0,Alam,Alam;Santai/Healing;Spot Foto,Sejarah;Outdoor,Belanja;Indoor;Religi,1.0,False,,"Alam: category=Wisata Alam (+4) | subcategory keyword: alam (+1.2) | tags keyword: alam, pemandangan (+2.1) || Santai/Healing: category=Wisata Alam (+1.5) | tags keyword: pemandangan (+1.05) | old multi_labels=Santai/Healing (+1) || Spot Foto: category=Wisata Alam (+1.5) | tags keyword: pemandangan (+1.05) | old multi_labels=Spot Foto (+1) || Sejarah: description keyword: bersejarah, prasasti (+1.5) || Outdoor: category=Wisata Alam (+2.5) | subcategory keyword: alam (+1.2) | tags keyword: outdoor, alam (+2.1)","{""Alam"": 11.15, ""Belanja"": -2.0, ""Edukasi"": 0.25, ""Kuliner"": -1.25, ""Outdoor"": 7.15, ""Santai/Healing"": 3.55, ""Sejarah"": 1.5, ""Spot Foto"": 3.55}",auto_rule_v1,auto_approved,,,,,Alam,Alam;Santai/Healing;Spot Foto,Sejarah;Outdoor,Belanja;Indoor;Religi,keep,active_candidate,,,,auto_rule_v1,True,False,False,False,,False,False,False,False,False,False,unknown,,True,6.38,,False,0.8823529411764706,tfidf_linearsvc,run_nlp_pipeline_v2,True,True,https://res.cloudinary.com/dnfnyjdmj/image/upload/v1781778656/muterbandung/wisata/LOC-129_main.jpg,https://www.google.com/maps/search/?api=1&query=Curug%20Dago&query_place_id=ChIJ8fAGLt7maC4Rs7svAM1wH-Y,,google_maps_extractor_2026_05_19,,Curug Dago,1.0,exact_normalized_title,accepted,Exact normalized title match.,Unknown,Unknown
LOC-132,Bird & Bromelia Pavilion,Wisata Satwa,"['Alam', 'Ramah Anak', 'Spot Foto', 'Kuliner', 'Santai/Healing']",-0.3076923076923077,26.0,Negatif,-6.8408955,107.6376637,35000.0,50000.0,09:00,17:00,90.0,Bird & Bromelia Pavilion di Pramestha Resort Town Lembang adalah taman burung edukatif yang memelihara sekitar 600 ekor burung dari berbagai spesies serta koleksi tanaman bromelia hias.,Per Orang,Taman burung,"Wisata, Umum, Menarik",09:00,17:00,09:00,17:00,internet_research_verified,internet_research_verified,filled_from_reliable_source,general_schedule_used_for_both,Jadwal umum digunakan untuk weekday dan weekend.,2.4615384615384617,8.0,16.0,Ramah Anak,Ramah Anak;Edukasi;Keluarga,Santai/Healing;Outdoor,Belanja,0.496,False,confidence < 0.65; Ramah Anak lacks explicit evidence,Ramah Anak: category=Wisata Satwa (+3) | old multi_labels=Ramah Anak (+1) || Edukasi: category=Wisata Satwa (+3) | description keyword: edukatif (+0.75) || Keluarga: category=Wisata Satwa (+3.5) || Santai/Healing: subcategory keyword: taman (+1.2) | description keyword: taman (+0.75) | old multi_labels=Santai/Healing (+1) || Outdoor: category=Wisata Satwa (+1.5) | subcategory keyword: taman (+1.2) | description keyword: taman (+0.75),"{""Alam"": 0.25, ""Belanja"": -2.0, ""Edukasi"": 3.75, ""Keluarga"": 3.5, ""Kuliner"": -1.25, ""Outdoor"": 3.45, ""Ramah Anak"": 4.0, ""Santai/Healing"": 2.95, ""Spot Foto"": 0.25}",auto_rule_v1,reviewed_keep,Edukasi,Edukasi;Keluarga;Ramah Anak,Outdoor;Spot Foto;Santai/Healing,Belanja;Malam;Kuliner,Edukasi,Edukasi;Keluarga;Ramah Anak,Outdoor;Spot Foto;Santai/Healing,Belanja;Malam;Kuliner,keep,active_candidate,True,0.86,Primary paling tepat Edukasi. Daya tarik utama taman burung edukatif dan interaksi dengan ratusan burung.,manual_browser_review_v1,True,False,False,True,,False,False,False,False,False,False,unknown,,True,9.61,,True,-0.3076923076923077,tfidf_linearsvc,run_nlp_pipeline_v2,True,True,https://res.cloudinary.com/dnfnyjdmj/image/upload/v1781778657/muterbandung/wisata/LOC-132_main.jpg,https://www.google.com/maps/search/?api=1&query=Bird%20Pavilion&query_place_id=ChIJISCBFczgaC4RAWCVd1ONVqE,,google_maps_extractor_2026_05_19,,Bird Pavilion,1.0,manual_override,accepted,Accepted by explicit title override.,Unknown,Unknown
LOC-133,Punclut Bandung (Puncak Ciumbuleuit),Wisata Alam,['Umum'],0.9,30.0,Sangat Positif,-6.8552,107.6116,0.0,0.0,08:00,00:00,120.0,Punclut (Puncak Ciumbuleuit) adalah kawasan wisata kuliner dan panorama di dataran tinggi Bandung yang menyajikan pemandangan city light malam hari dan spot foto instagramable perbukitan.,Gratis,Kawasan panorama,"Alam, Outdoor, Pemandangan, Udara Segar",08:00,00:00,08:00,00:00,internet_research_verified,internet_research_verified,filled_from_reliable_source,general_schedule_used_for_both,Jadwal umum digunakan untuk weekday dan weekend.,4.7,28.0,1.0,Alam,Alam;Spot Foto;Santai/Healing,Outdoor;Gratis;Malam,Belanja;Indoor;Religi,0.921,False,,"Alam: category=Wisata Alam (+4) | subcategory keyword: panorama (+1.2) | tags keyword: alam, pemandangan (+2.1) || Spot Foto: category=Wisata Alam (+1.5) | subcategory keyword: panorama (+1.2) | tags keyword: pemandangan (+1.05) || Santai/Healing: category=Wisata Alam (+1.5) | tags keyword: pemandangan (+1.05) | description keyword: pemandangan (+0.75) || Outdoor: category=Wisata Alam (+2.5) | tags keyword: outdoor, alam (+2.1) || Gratis: price_type/price_max indicates free (+3) || Malam: description keyword: malam (+0.75) | opening hours support night visit (+1.5)","{""Alam"": 8.8, ""Belanja"": -2.0, ""Gratis"": 3.0, ""Kuliner"": -0.75, ""Malam"": 2.25, ""Outdoor"": 4.6, ""Santai/Healing"": 3.3, ""Spot Foto"": 6.75}",auto_rule_v1,reviewed,,,,,Alam,Alam;Spot Foto;Santai/Healing,Outdoor;Gratis;Malam,Belanja;Indoor;Religi,keep,active_candidate,True,,"Updated master status/facility 2026-05-27; status=✓ Aktif; decision=include_active; confidence=Medium; sources=Detik Travel Des 2024, Siliwangi Trans Jun 2025; note=Kawasan aktif setiap hari 08:00–21:00. Tidak ada tiket masuk. Banyak kafe, spot foto, kuliner malam. Ramai dikunjungi 2025.; revision=Data awal dipertahankan dari tabel sebelumnya.",auto_rule_v1,True,True,False,False,updated_master_status_facility_2026-05-27:status:include_active,False,False,False,False,False,False,unknown,,True,7.42,,False,0.9,google_maps_stars_fallback,compass_manual_accepted_2026-06-09,True,True,https://images.unsplash.com/photo-1501785888041-af3ef285b470?w=800&q=80,https://images.unsplash.com/photo-1501785888041-af3ef285b470?w=800&q=80,,manual_excel_2026-06-09,,Punclut Bandung (Puncak Ciumbuleuit),1.0,manual_excel,manual_accepted,Manual media filled from Daftar_Destinasi_Wisata_Bandung_Professional.xlsx on 2026-06-09.,Unknown,Unknown
LOC-134,Bukit Bintang Bandung (Patahan Lembang),Wisata Alam,['Umum'],0.9,30.0,Sangat Positif,-6.8219342,107.6623629,15000.0,25000.0,06:00,17:00,120.0,"Bukit Bintang Bandung di kawasan Cimenyan menawarkan panorama hutan pinus, jalur hiking menuju Patahan Lembang, serta pesona city light gemerlap Kota Bandung dari ketinggian 1.442 mdpl.",Per Orang,Daya tarik alam,"Alam, Outdoor, Pemandangan, Udara Segar",00:00,23:59,00:00,23:59,internet_research_verified,internet_research_verified,filled_from_reliable_source,general_schedule_used_for_both,Jadwal umum digunakan untuk weekday dan weekend. | Manual correction 2026-06-09: user confirmed Bukit Bintang Bandung is open 24 hours; hours normalized to 00:00-23:59.,4.666667,28.0,1.0,Alam,Alam;Spot Foto;Outdoor,Santai/Healing;Malam,Belanja;Indoor;Kuliner;Religi,1.0,False,,"Alam: category=Wisata Alam (+4) | subcategory keyword: alam (+1.2) | tags keyword: alam, pemandangan (+2.1) || Spot Foto: category=Wisata Alam (+1.5) | tags keyword: pemandangan (+1.05) | description keyword: panorama, bukit (+1.5) || Outdoor: category=Wisata Alam (+2.5) | subcategory keyword: alam (+1.2) | tags keyword: outdoor, alam (+2.1) || Santai/Healing: category=Wisata Alam (+1.5) | tags keyword: pemandangan (+1.05) || Malam: opening hours support night visit (+1.5)","{""Alam"": 10.15, ""Belanja"": -2.0, ""Kuliner"": -1.5, ""Malam"": 1.5, ""Outdoor"": 6.55, ""Petualangan"": 0.75, ""Santai/Healing"": 2.55, ""Spot Foto"": 4.65}",auto_rule_v1,reviewed,,,,,Alam,Alam;Spot Foto;Outdoor,Santai/Healing;Malam,Belanja;Indoor;Kuliner;Religi,keep,active_candidate,True,,"Manual reviewer override 2026-05-26: active; Google Maps name observed as Puncak Bintang. Do not rename primary location_name yet; retain alias in curation_note. Facility text mentions parkir, toilet, and mushola. Sources: manual_reviewer_google_maps_observation_2026-05-26",auto_rule_v1,True,True,False,False,manual_docx_override:active_status:opening_hours:facility:alias,True,False,True,True,False,True,unknown,,True,12.67,,False,0.9,google_maps_stars_fallback,compass_manual_accepted_2026-06-09,True,True,https://images.unsplash.com/photo-1475274047050-1d0c0975c63e?w=800&q=80,https://images.unsplash.com/photo-1475274047050-1d0c0975c63e?w=800&q=80,,manual_excel_2026-06-09,,Bukit Bintang Bandung (Patahan Lembang),1.0,manual_excel,manual_accepted,Manual media filled from Daftar_Destinasi_Wisata_Bandung_Professional.xlsx on 2026-06-09.,Unknown,Unknown
LOC-135,Taman Main Mili-Mili & Hutan Mycelia,Rekreasi Keluarga,"['Alam', 'Ramah Anak', 'Spot Foto', 'Edukasi', 'Santai/Healing', 'Wahana Ekstrem']",0.7647058823529411,17.0,Sangat Positif,-6.7854682,107.6516053,50000.0,50000.0,18:00,22:00,180.0,"Taman Main Mili-Mili & Hutan Mycelia adalah wahana wisata malam interaktif di Grafika Cikole yang mengangkat tema peradaban jamur dengan instalasi cahaya, video mapping, dan treasure hunt di hutan pinus.",Per Orang,Taman rekreasi tematik,"Keluarga, Anak-anak, Wahana, Seru",18:00,22:00,18:00,22:00,internet_research_verified,internet_research_verified,filled_from_reliable_source,general_schedule_used_for_both,Jadwal umum digunakan untuk weekday dan weekend.,4.411764705882353,15.0,2.0,Keluarga,Keluarga;Alam;Santai/Healing,Ramah Anak;Edukasi;Outdoor,Belanja;Kuliner,1.0,False,,"Keluarga: category=Rekreasi Keluarga (+4.5) | tags keyword: keluarga, anak, anak-anak, wahana (+4.2) | description keyword: wahana (+0.75) || Alam: description keyword: hutan (+0.75) | name keyword: hutan (+0.6) | old multi_labels=Alam (+1) || Santai/Healing: subcategory keyword: taman (+1.2) | description keyword: taman (+0.75) | name keyword: taman (+0.6) || Ramah Anak: category=Rekreasi Keluarga (+2.5) | tags keyword: anak, anak-anak (+2.1) | old multi_labels=Ramah Anak (+1) || Edukasi: description keyword: interaktif (+0.75) | old multi_labels=Edukasi (+1) || Outdoor: subcategory keyword: taman (+1.2) | description keyword: taman, hutan (+1.5) | name keyword: taman, hutan (+1.2)","{""Alam"": 4.35, ""Belanja"": -2.0, ""Edukasi"": 1.75, ""Keluarga"": 9.45, ""Kuliner"": -1.5, ""Malam"": 2.25, ""Outdoor"": 3.9, ""Petualangan"": 0.25, ""Ramah Anak"": 5.6, ""Santai/Healing"": 3.55, ""Spot Foto"": 0.25}",auto_rule_v1,reviewed,,,,,Keluarga,Keluarga;Alam;Santai/Healing,Ramah Anak;Edukasi;Outdoor,Belanja;Kuliner,keep,active_candidate,True,,"Updated master status/facility 2026-05-27; status=✓ Aktif; decision=include_active; confidence=Medium; sources=Grafika Cikole, rumah123.com Agu 2025; note=Aktif sebagai bagian dari Terminal Wisata Grafika Cikole. Hutan Mycelia adalah wahana malam di kawasan yang sama.; revision=Data awal dipertahankan dari tabel sebelumnya. | Updated master status/facility 2026-05-27; facility_status=sebagian; facility_evidence=mengikuti_catatan_lama; facilities=Area Parkir, Toilet, Mushola; action=review_sumber_lama_jika_perlu; note=Bagian dari Grafika Cikole. Hutan Mycelia malam hari. Fasilitas dasar ada.; revision=Data dari tabel fasilitas sebelumnya dipertahankan.",auto_rule_v1,True,False,False,True,updated_master_status_facility_2026-05-27:status:include_active | updated_master_status_facility_2026-05-27:facility,True,False,True,True,False,False,unknown,,True,15.93,,True,0.7647058823529411,tfidf_linearsvc,run_nlp_pipeline_v2,True,True,https://res.cloudinary.com/dnfnyjdmj/image/upload/v1781778658/muterbandung/wisata/LOC-135_main.jpg,https://images.unsplash.com/photo-1448375240586-882707db888b?w=800&q=80,,manual_excel_2026-06-09,,Taman Main Mili-Mili & Hutan Mycelia,1.0,manual_excel,manual_accepted,Manual media filled from Daftar_Destinasi_Wisata_Bandung_Professional.xlsx on 2026-06-09.,Unknown,Unknown
