LOC-064,Nimo Highland,Rekreasi Keluarga,"['Alam', 'Ramah Anak', 'Spot Foto', 'Kuliner', 'Santai/Healing', 'Wahana Ekstrem']",0.752,250.0,Sangat Positif,-7.2203,107.5781,30000.0,60000.0,09:00,17:00,180.0,Kawasan wisata instagramable di Pangalengan dengan jembatan kaca U sepanjang 150 meter di atas kebun teh dan memiliki desain ikonik bertema kubah putih Santorini.,Per Orang,Wisata panorama buatan,"Keluarga, Anak-anak, Wahana, Seru",09:00,17:00,05:00,18:00,internet_research_verified,internet_research_verified,filled_from_reliable_source,verified,"Jadwal weekday dan weekend berbeda, keduanya terisi dari sumber.",4.344,209.0,21.0,Keluarga,Keluarga;Alam;Spot Foto,Ramah Anak,Belanja,1.0,False,,"Keluarga: category=Rekreasi Keluarga (+4.5) | tags keyword: keluarga, anak, anak-anak, wahana (+4.2) || Alam: subcategory keyword: panorama (+1.2) | description keyword: kebun teh (+0.75) | old multi_labels=Alam (+1) || Spot Foto: subcategory keyword: panorama (+1.2) | description keyword: instagramable, ikonik (+1.5) | old multi_labels=Spot Foto (+1) || Ramah Anak: category=Rekreasi Keluarga (+2.5) | tags keyword: anak, anak-anak (+2.1) | old multi_labels=Ramah Anak (+1)","{""Alam"": 4.95, ""Belanja"": -2.0, ""Keluarga"": 8.7, ""Kuliner"": -1.25, ""Outdoor"": 0.75, ""Petualangan"": 0.25, ""Ramah Anak"": 5.6, ""Santai/Healing"": 0.25, ""Spot Foto"": 3.7}",auto_rule_v1,auto_approved,,,,,Keluarga,Keluarga;Alam;Spot Foto,Ramah Anak,Belanja,keep,active_candidate,,,"Updated master status/facility 2026-05-27; facility_status=lengkap; facility_evidence=ringkasan_agent_belum_url_per_baris; facilities=Area Parkir, Toilet, Mushola, Cafe, Spot Foto (Jembatan Kaca), Penyewaan ATV, Shuttle Gratis; action=ready_sebagai_data_awal_fasilitas_umum; note=Diisi dari ringkasan fasilitas yang diberikan user/AI agent: Area Parkir, Toilet, Mushola, Cafe, Spot Foto (Jembatan Kaca), Penyewaan ATV, Shuttle Gratis. Kolom kursi roda dan pet friendly tetap ? jika tidak disebut eksplisit.; revision=Sebelumnya kosong total, kini fasilitas utama sudah terisi.",auto_rule_v1,True,False,False,True,updated_master_status_facility_2026-05-27:facility,True,False,True,True,False,False,unknown,,True,33.35,,False,0.752,tfidf_linearsvc,run_nlp_pipeline_v2,True,True,https://res.cloudinary.com/dnfnyjdmj/image/upload/v1781778565/muterbandung/wisata/LOC-064_main.jpg,https://www.google.com/maps/search/?api=1&query=NIMO%20Highland&query_place_id=ChIJo7zTkaSXaC4R8ysl1smnMVA,https://www.nimoland.com/,google_maps_extractor_2026_05_19,,NIMO Highland,1.0,exact_normalized_title,accepted,Exact normalized title match.,Unknown,Unknown
LOC-065,Orchid Forest Cikole,Wisata Alam,"['Alam', 'Ramah Anak', 'Spot Foto', 'Kuliner', 'Santai/Healing', 'Wahana Ekstrem']",0.7434782608695653,230.0,Sangat Positif,-6.7801991,107.6379318,40000.0,40000.0,10:00,18:00,120.0,"Lebih dari 20.000 anggrek ada di wisata hutan ini, dengan area bermain & jembatan gantung.",Per Orang,Hutan wisata,"Alam, Outdoor, Pemandangan, Udara Segar",09:00,18:00,08:00,19:00,internet_research_verified,internet_research_verified,filled_from_reliable_source,verified,"Jadwal weekday dan weekend berbeda, keduanya terisi dari sumber.",4.404347826086957,194.0,23.0,Alam,Alam;Santai/Healing;Spot Foto,Outdoor,Belanja;Indoor;Religi,0.958,False,,"Alam: category=Wisata Alam (+4) | subcategory keyword: hutan (+1.2) | tags keyword: alam, pemandangan (+2.1) || Santai/Healing: category=Wisata Alam (+1.5) | tags keyword: pemandangan (+1.05) | old multi_labels=Santai/Healing (+1) || Spot Foto: category=Wisata Alam (+1.5) | tags keyword: pemandangan (+1.05) | old multi_labels=Spot Foto (+1) || Outdoor: category=Wisata Alam (+2.5) | subcategory keyword: hutan (+1.2) | tags keyword: outdoor, alam (+2.1)","{""Alam"": 9.05, ""Belanja"": -2.0, ""Kuliner"": -1.25, ""Outdoor"": 6.55, ""Petualangan"": 0.25, ""Ramah Anak"": 0.25, ""Santai/Healing"": 3.55, ""Spot Foto"": 3.55}",auto_rule_v1,auto_approved,,,,,Alam,Alam;Santai/Healing;Spot Foto,Outdoor,Belanja;Indoor;Religi,keep,active_candidate,,,,auto_rule_v1,True,False,False,False,,False,False,False,False,False,False,unknown,,True,16.11,,False,0.7434782608695653,tfidf_linearsvc,run_nlp_pipeline_v2,True,True,https://res.cloudinary.com/dnfnyjdmj/image/upload/v1781778566/muterbandung/wisata/LOC-065_main.jpg,https://www.google.com/maps/search/?api=1&query=Orchid%20Forest%20Cikole&query_place_id=ChIJBxan4TjgaC4RYi4ejXdY-Hk,https://www.instagram.com/orchidforestcikole,google_maps_extractor_2026_05_19,,Orchid Forest Cikole,1.0,exact_normalized_title,accepted,Exact normalized title match.,Unknown,Unknown
LOC-066,Pandiga Educreation Sports,Rekreasi Keluarga,"['Alam', 'Ramah Anak', 'Kuliner', 'Santai/Healing', 'Wahana Ekstrem']",0.8888888888888888,18.0,Sangat Positif,-6.8755807,107.5554364,30000.0,35000.0,08:00,18:00,180.0,"Fasilitas untuk bulu tangkis, sepak bola indoor & kolam renang outdoor, plus teras taman & pujasera ramai.",Per Orang,Olahraga rekreasi,"Keluarga, Anak-anak, Wahana, Seru",08:00,18:00,08:00,18:00,internet_research_verified,internet_research_verified,filled_from_reliable_source,general_schedule_used_for_both,Jadwal umum digunakan untuk weekday dan weekend.,4.222222222222222,17.0,1.0,Keluarga,Keluarga;Ramah Anak;Kuliner,Santai/Healing;Outdoor,Belanja,1.0,False,,"Keluarga: category=Rekreasi Keluarga (+4.5) | tags keyword: keluarga, anak, anak-anak, wahana (+4.2) || Ramah Anak: category=Rekreasi Keluarga (+2.5) | tags keyword: anak, anak-anak (+2.1) | old multi_labels=Ramah Anak (+1) || Kuliner: description keyword: pujasera (+0.75) | old multi_labels=Kuliner (+1) | family attraction with explicit culinary evidence (+2.5) || Santai/Healing: description keyword: taman (+0.75) | old multi_labels=Santai/Healing (+1) || Outdoor: description keyword: outdoor, taman (+1.5)","{""Alam"": 0.25, ""Belanja"": -2.0, ""Indoor"": 0.75, ""Keluarga"": 8.7, ""Kuliner"": 4.25, ""Outdoor"": 1.5, ""Petualangan"": 0.25, ""Ramah Anak"": 5.6, ""Santai/Healing"": 1.75}",auto_rule_v1,auto_approved,,,,,Keluarga,Keluarga;Ramah Anak;Kuliner,Santai/Healing;Outdoor,Belanja,keep,active_candidate,,,"Updated master status/facility 2026-05-27; facility_status=lengkap; facility_evidence=ringkasan_agent_belum_url_per_baris; facilities=Area Parkir, Toilet, Mushola, Kolam Renang, Lapangan Olahraga, Cafe/Kantin; action=ready_sebagai_data_awal_fasilitas_umum; note=Diisi dari ringkasan fasilitas yang diberikan user/AI agent: Area Parkir, Toilet, Mushola, Kolam Renang, Lapangan Olahraga, Cafe/Kantin. Kolom kursi roda dan pet friendly tetap ? jika tidak disebut eksplisit.; revision=Sebelumnya kosong total, kini fasilitas utama sudah terisi.",auto_rule_v1,True,False,False,True,updated_master_status_facility_2026-05-27:facility,True,False,True,True,False,False,high,,True,7.67,,True,0.8888888888888888,tfidf_linearsvc,run_nlp_pipeline_v2,True,True,https://res.cloudinary.com/dnfnyjdmj/image/upload/v1781778567/muterbandung/wisata/LOC-066_main.jpg,https://www.google.com/maps/search/?api=1&query=Pandiga%20Educreation%20Sports&query_place_id=ChIJ9_jNcTnkaC4RS3p5dhgPahU,http://www.pandiga-educreation.com/,google_maps_extractor_2026_05_19,,Pandiga Educreation Sports,1.0,exact_normalized_title,accepted,Exact normalized title match.,Unknown,Unknown
LOC-068,Pasar Cimindi,Tempat Belanja,['Umum'],0.866667,30.0,Sangat Positif,-6.8971851,107.5585651,0.0,0.0,00:00,23:59,150.0,Pasar tradisional rakyat yang dikelola Pemerintah Kota Cimahi sebagai pusat ekonomi dan penyedia kebutuhan pokok harian masyarakat sekitar.,Gratis,Pusat belanja,"Belanja, Indoor, Kuliner, Modern",00:00,23:59,00:00,23:59,internet_research_verified,internet_research_verified,filled_from_reliable_source,general_schedule_used_for_both,Jadwal umum digunakan untuk weekday dan weekend.,4.533333,27.0,1.0,Belanja,Belanja;Indoor;Gratis,Malam,Alam;Petualangan;Religi;Sejarah,1.0,False,,Belanja: category=Tempat Belanja (+5) | subcategory keyword: belanja (+1.2) | tags keyword: belanja (+1.05) || Indoor: category=Tempat Belanja (+2) | tags keyword: indoor (+1.05) || Gratis: price_type/price_max indicates free (+3) || Malam: opening hours support night visit (+1.5),"{""Alam"": -2.5, ""Belanja"": 8.6, ""Budaya"": 0.75, ""Gratis"": 3.0, ""Indoor"": 3.05, ""Kuliner"": 0.55, ""Malam"": 1.5, ""Santai/Healing"": 0.8}",auto_rule_v1,reviewed,,,,,Belanja,Belanja;Indoor;Gratis,Malam,Alam;Petualangan;Religi;Sejarah,keep,active_candidate,True,,Updated master status/facility 2026-05-27; status=✓ Aktif; decision=include_active; confidence=Medium; sources=Karakteristik pasar tradisional Bandung; note=Pasar tradisional aktif. Tidak ada data penutupan. Pasar tradisional umumnya beroperasi setiap hari.; revision=Data awal dipertahankan dari tabel sebelumnya. | Updated master status/facility 2026-05-27; facility_status=sebagian; facility_evidence=mengikuti_catatan_lama; facilities=Area Parkir; action=review_sumber_lama_jika_perlu; note=Pasar tradisional; parkir terbatas di badan jalan. Fasilitas lain sangat minim.; revision=Data dari tabel fasilitas sebelumnya dipertahankan.,auto_rule_v1,True,True,True,False,updated_master_status_facility_2026-05-27:status:include_active | updated_master_status_facility_2026-05-27:facility,True,False,False,False,False,True,medium,Pasar Wisata,True,6.01,,False,0.866667,google_maps_stars_fallback,compass_manual_accepted_2026-06-09,True,True,https://res.cloudinary.com/dnfnyjdmj/image/upload/v1781778568/muterbandung/wisata/LOC-068_main.jpg,https://www.google.com/maps/search/?api=1&query=Pasar%20Cimindi&query_place_id=ChIJ_ZYRy8jlaC4RPaMxHmIuSbE,https://app.bayurizki.my.id/,google_maps_extractor_2026_05_19,,Pasar Cimindi,1.0,exact_normalized_title,accepted,Exact normalized title match.,Unknown,Unknown
LOC-069,Pemandian Cipanas Cileungsing,Wisata Alam,"['Alam', 'Ramah Anak', 'Kuliner', 'Belanja']",0.6111111111111112,54.0,Sangat Positif,-7.00583,107.51944,10000.0,15000.0,00:00,23:59,120.0,Pemandian air panas belerang alami di kaki Gunung Tampomas Sumedang yang populer untuk terapi kesehatan dan relaksasi keluarga.,Per Orang,Daya tarik alam,"Alam, Outdoor, Pemandangan, Udara Segar",00:00,23:59,00:00,23:59,internet_research_verified,internet_research_verified,filled_from_reliable_source,general_schedule_used_for_both,Jadwal umum digunakan untuk weekday dan weekend.,4.222222222222222,39.0,6.0,Alam,Alam;Outdoor,Santai/Healing;Spot Foto;Malam,Belanja;Indoor;Religi,1.0,False,,"Alam: category=Wisata Alam (+4) | subcategory keyword: alam (+1.2) | tags keyword: alam, pemandangan (+2.1) || Outdoor: category=Wisata Alam (+2.5) | subcategory keyword: alam (+1.2) | tags keyword: outdoor, alam (+2.1) || Santai/Healing: category=Wisata Alam (+1.5) | tags keyword: pemandangan (+1.05) || Spot Foto: category=Wisata Alam (+1.5) | tags keyword: pemandangan (+1.05) || Malam: opening hours support night visit (+1.5)","{""Alam"": 9.8, ""Belanja"": -1.75, ""Keluarga"": 0.75, ""Kuliner"": -1.25, ""Malam"": 1.5, ""Outdoor"": 6.55, ""Ramah Anak"": 0.25, ""Santai/Healing"": 2.55, ""Spot Foto"": 2.55}",auto_rule_v1,reviewed,,,,,Alam,Alam;Outdoor,Santai/Healing;Spot Foto,Belanja;Indoor;Religi;Malam,keep,active_candidate,True,,"Updated master status/facility 2026-05-27; status=✓ Aktif; decision=include_active; confidence=Medium; sources=nativeindonesia.com, sumedangtandang.com; note=Aktif buka 24 jam nonstop. Tiket Rp10.000. Di Desa Cilangkap, Buahdua, Sumedang (bukan Bandung kota).; revision=Data awal dipertahankan dari tabel sebelumnya.",auto_rule_v1,True,False,False,False,Malam label removed: not night_verified | updated_master_status_facility_2026-05-27:status:include_active,False,False,False,False,False,False,unknown,,False,13.45,Sumedang/Jatigede coordinate too close to Bandung center or outside strict scope: 13.5 km from Alun-Alun Bandung,False,0.6111111111111112,tfidf_linearsvc,run_nlp_pipeline_v2,True,True,https://res.cloudinary.com/dnfnyjdmj/image/upload/v1781778570/muterbandung/wisata/LOC-069_main.jpg,https://www.google.com/maps/search/?api=1&query=Pemandian%20Cipanas%20Cileungsing&query_place_id=ChIJm3yMWj8qaS4RdQaLMvAJa8k,,google_maps_extractor_2026_05_19,,Pemandian Cipanas Cileungsing,1.0,exact_normalized_title,accepted,Exact normalized title match.,Unknown,Unknown
LOC-070,Penangkaran Rusa Ranca Upas,Tempat Camping,"['Alam', 'Ramah Anak', 'Spot Foto', 'Kuliner', 'Belanja', 'Santai/Healing', 'Wahana Ekstrem']",0.885,200.0,Sangat Positif,-7.1227905,107.424115,28000.0,44000.0,07:00,17:30,90.0,"Bumi perkemahan santai tepi pantai dengan kano, memberi makan rusa, kolam mata air panas & taman bermain air.",Per Orang,Camping ground,"Wisata, Umum, Menarik",07:00,17:30,07:00,17:30,internet_research_verified,internet_research_verified,filled_from_reliable_source,general_schedule_used_for_both,Jadwal umum digunakan untuk weekday dan weekend.,4.55,184.0,7.0,Alam,Alam;Petualangan;Santai/Healing,Ramah Anak;Outdoor,Belanja,0.683,False,,"Alam: category=Tempat Camping (+3.5) | subcategory keyword: camping (+1.2) | name keyword: ranca (+0.6) || Petualangan: category=Tempat Camping (+3.5) | subcategory keyword: camping (+1.2) | old multi_labels=Wahana Ekstrem (+1) || Santai/Healing: category=Tempat Camping (+1) | description keyword: santai, taman (+1.5) | old multi_labels=Santai/Healing (+1) || Ramah Anak: description keyword: taman bermain (+0.75) | old multi_labels=Ramah Anak (+1) || Outdoor: category=Tempat Camping (+2.5) | subcategory keyword: camping (+1.2) | description keyword: taman (+0.75)","{""Alam"": 6.3, ""Belanja"": -1.75, ""Kuliner"": -1.25, ""Outdoor"": 4.45, ""Petualangan"": 5.7, ""Ramah Anak"": 1.75, ""Santai/Healing"": 3.5, ""Spot Foto"": 0.25}",auto_rule_v1,auto_approved,,,,,Alam,Alam;Petualangan;Santai/Healing,Ramah Anak;Outdoor,Belanja,keep,active_candidate,,,,auto_rule_v1,True,False,False,True,,False,False,False,False,False,False,unknown,,True,30.12,,True,0.885,tfidf_linearsvc,run_nlp_pipeline_v2,True,True,https://res.cloudinary.com/dnfnyjdmj/image/upload/v1781778571/muterbandung/wisata/LOC-070_main.jpg,https://www.google.com/maps/search/?api=1&query=Penangkaran%20Rusa%20Ranca%20Upas&query_place_id=ChIJlyTtJoSMaC4RTwHcCq_vgBI,http://www.kampungcai.com/,google_maps_extractor_2026_05_19,,Penangkaran Rusa Ranca Upas,1.0,exact_normalized_title,accepted,Exact normalized title match.,Unknown,Unknown
LOC-071,Puncak Bukit Kujang Gunung Bohong,Wisata Alam,"['Alam', 'Ramah Anak', 'Spot Foto', 'Kuliner']",0.9347826086956522,46.0,Sangat Positif,-6.8766,107.5199,0.0,0.0,06:00,18:00,120.0,Puncak area Gunung Bohong Cimahi yang dihiasi tugu Kujang Kembar dan menyajikan panorama lanskap perkotaan Bandung Raya dari ketinggian.,Gratis,Puncak bukit,"Alam, Outdoor, Pemandangan, Udara Segar",06:00,18:00,06:00,18:00,internet_research_verified,internet_research_verified,filled_from_reliable_source,general_schedule_used_for_both,Jadwal umum digunakan untuk weekday dan weekend.,4.826086956521739,44.0,1.0,Alam,Alam;Spot Foto;Outdoor,Santai/Healing;Gratis,Belanja;Indoor;Religi,1.0,False,,"Alam: category=Wisata Alam (+4) | subcategory keyword: bukit (+1.2) | tags keyword: alam, pemandangan (+2.1) || Spot Foto: category=Wisata Alam (+1.5) | subcategory keyword: bukit (+1.2) | tags keyword: pemandangan (+1.05) || Outdoor: category=Wisata Alam (+2.5) | tags keyword: outdoor, alam (+2.1) | description keyword: gunung (+0.75) || Santai/Healing: category=Wisata Alam (+1.5) | tags keyword: pemandangan (+1.05) || Gratis: price_type/price_max indicates free (+3)","{""Alam"": 11.0, ""Belanja"": -2.0, ""Gratis"": 3.0, ""Kuliner"": -1.25, ""Outdoor"": 5.95, ""Ramah Anak"": 0.25, ""Santai/Healing"": 2.55, ""Spot Foto"": 6.85}",auto_rule_v1,auto_approved,,,,,Alam,Alam;Spot Foto;Outdoor,Santai/Healing;Gratis,Belanja;Indoor;Religi,keep,active_candidate,,,,auto_rule_v1,True,False,False,False,,False,False,False,False,False,False,unknown,,True,10.85,,False,0.9347826086956522,tfidf_linearsvc,run_nlp_pipeline_v2,True,True,https://res.cloudinary.com/dnfnyjdmj/image/upload/v1781778572/muterbandung/wisata/LOC-071_main.jpg,https://www.google.com/maps/search/?api=1&query=Puncak%20Bukit%20Kujang%20Gunung%20Bohong&query_place_id=ChIJpalhFPHlaC4R_5WE_LUF0Bw,,google_maps_extractor_2026_05_19,,Puncak Bukit Kujang Gunung Bohong,1.0,exact_normalized_title,accepted,Exact normalized title match.,Unknown,Unknown
LOC-072,Puncak Eurad,Wisata Alam,"['Alam', 'Spot Foto', 'Kuliner', 'Santai/Healing']",0.3255813953488372,43.0,Positif,-6.7903231,107.68087,5000.0,5000.0,07:00,17:00,120.0,"Puncak Eurad adalah objek wisata perbukitan sejuk di perbatasan Lembang dan Subang, menawarkan panorama hutan pinus, hamparan kebun teh, gardu pandang foto ikonik, serta bumi perkemahan.",Per Orang,Daya tarik alam,"Alam, Outdoor, Pemandangan, Udara Segar",00:00,23:59,00:00,23:59,internet_research_verified,internet_research_verified,filled_from_reliable_source,general_schedule_used_for_both,Jadwal umum digunakan untuk weekday dan weekend.,3.604651162790698,27.0,13.0,Alam,Alam;Spot Foto;Santai/Healing,Outdoor;Malam,Belanja;Indoor;Religi,1.0,False,,"Alam: category=Wisata Alam (+4) | subcategory keyword: alam (+1.2) | tags keyword: alam, pemandangan (+2.1) || Spot Foto: category=Wisata Alam (+1.5) | tags keyword: pemandangan (+1.05) | description keyword: foto, panorama, ikonik (+2.25) || Santai/Healing: category=Wisata Alam (+1.5) | tags keyword: pemandangan (+1.05) | description keyword: sejuk (+0.75) || Outdoor: category=Wisata Alam (+2.5) | subcategory keyword: alam (+1.2) | tags keyword: outdoor, alam (+2.1) || Malam: opening hours support night visit (+1.5)","{""Alam"": 11.3, ""Belanja"": -2.0, ""Kuliner"": -1.25, ""Malam"": 1.5, ""Outdoor"": 7.3, ""Santai/Healing"": 4.3, ""Spot Foto"": 5.8}",auto_rule_v1,auto_approved,,,,,Alam,Alam;Spot Foto;Santai/Healing,Outdoor,Belanja;Indoor;Religi;Malam,keep,active_candidate,,,,auto_rule_v1,True,False,False,False,Malam label removed: not night_verified,False,False,False,False,False,False,unknown,,True,16.73,,False,0.3255813953488372,tfidf_linearsvc,run_nlp_pipeline_v2,True,True,https://res.cloudinary.com/dnfnyjdmj/image/upload/v1781778574/muterbandung/wisata/LOC-072_main.jpg,https://www.google.com/maps/search/?api=1&query=Puncak%20Eurad&query_place_id=ChIJ5_6aW8XfaC4RrtKR92P_PC4,,google_maps_extractor_2026_05_19,,Puncak Eurad,1.0,exact_normalized_title,accepted,Exact normalized title match.,Unknown,Unknown
LOC-073,Ranca Upas Ciwidey,Tempat Camping,"['Alam', 'Ramah Anak', 'Spot Foto', 'Kuliner', 'Santai/Healing', 'Wahana Ekstrem']",0.82,200.0,Sangat Positif,-7.1384888,107.3917416,28000.0,28000.0,08:00,17:00,90.0,"Ranca Upas adalah kawasan bumi perkemahan terpopuler di Rancabali, Ciwidey, yang terkenal dengan penangkaran rusa ramah interaksi, kolam pemandian air panas, serta panorama hutan pegunungan sejuk.",Per Orang,Camping ground,"Wisata, Umum, Menarik",00:00,23:59,00:00,23:59,internet_research_verified,internet_research_verified,filled_from_reliable_source,general_schedule_used_for_both,Jadwal umum digunakan untuk weekday dan weekend.,4.485,177.0,13.0,Alam,Alam;Petualangan;Outdoor,Santai/Healing;Spot Foto;Malam,Belanja,1.0,False,,"Alam: category=Tempat Camping (+3.5) | subcategory keyword: camping (+1.2) | description keyword: hutan, pemandian air panas, panorama, sejuk (+3) || Petualangan: category=Tempat Camping (+3.5) | subcategory keyword: camping (+1.2) | old multi_labels=Wahana Ekstrem (+1) || Outdoor: category=Tempat Camping (+2.5) | subcategory keyword: camping (+1.2) | description keyword: hutan (+0.75) || Santai/Healing: category=Tempat Camping (+1) | description keyword: sejuk (+0.75) | old multi_labels=Santai/Healing (+1) || Spot Foto: description keyword: panorama (+0.75) | old multi_labels=Spot Foto (+1) || Malam: opening hours support night visit (+1.5)","{""Alam"": 9.3, ""Belanja"": -2.0, ""Kuliner"": -1.25, ""Malam"": 1.5, ""Outdoor"": 4.45, ""Petualangan"": 5.7, ""Ramah Anak"": 0.25, ""Santai/Healing"": 2.75, ""Spot Foto"": 1.75}",auto_rule_v1,auto_approved,,,,,Alam,Alam;Petualangan;Outdoor,Santai/Healing;Spot Foto,Belanja;Malam,keep,active_candidate,,,,auto_rule_v1,True,False,False,False,Malam label removed: not night_verified,False,False,False,False,False,False,unknown,,True,33.84,,False,0.82,tfidf_linearsvc,run_nlp_pipeline_v2,True,True,https://res.cloudinary.com/dnfnyjdmj/image/upload/v1781778575/muterbandung/wisata/LOC-073_main.png,https://www.google.com/maps/search/?api=1&query=Ranca%20Upas%20Ciwidey&query_place_id=ChIJsd2qQbGNaC4Rrz24GOGYKGw,https://www.rancaupas.id/,google_maps_extractor_2026_05_19,,Ranca Upas Ciwidey,1.0,exact_normalized_title,accepted,Exact normalized title match.,Unknown,Unknown
LOC-074,Rumah Makan Sangu Liwet Ibu Ika Pasirjambu Ciwidey,Tempat Kuliner,"['Alam', 'Ramah Anak', 'Kuliner', 'Belanja']",0.5656565656565656,198.0,Positif,-7.0728751,107.4894089,0.0,0.0,08:00,20:00,90.0,Restoran kuliner khas Sunda di jalur wisata Ciwidey yang menyajikan nasi liwet lezat di saung-saung asri di atas kolam ikan pedesaan.,Gratis,Rumah makan,"Kuliner, Nongkrong, Santai",08:00,20:00,08:00,20:00,internet_research_verified,internet_research_verified,filled_from_reliable_source,general_schedule_used_for_both,Jadwal umum digunakan untuk weekday dan weekend.,3.984848484848485,139.0,27.0,Kuliner,Kuliner;Santai/Healing;Gratis,Malam,Belanja;Petualangan;Religi;Sejarah,1.0,False,,"Kuliner: category=Tempat Kuliner (+5) | subcategory keyword: rumah makan (+1.2) | tags keyword: kuliner (+1.05) || Santai/Healing: category=Tempat Kuliner (+2) | tags keyword: santai, nongkrong (+2.1) || Gratis: price_type/price_max indicates free (+3) || Malam: opening hours support night visit (+1.5)","{""Alam"": -0.75, ""Belanja"": -1.75, ""Budaya"": 0.75, ""Gratis"": 3.0, ""Kuliner"": 11.1, ""Malam"": 1.5, ""Ramah Anak"": 0.25, ""Santai/Healing"": 4.1}",auto_rule_v1,auto_approved,,,,,Kuliner,Kuliner;Santai/Healing;Gratis,Malam,Belanja;Petualangan;Religi;Sejarah,keep,active_candidate,,,"Updated master status/facility 2026-05-27; facility_status=lengkap; facility_evidence=ringkasan_agent_belum_url_per_baris; facilities=Area Parkir, Toilet, Mushola, Area Makan Lesehan, Taman Bermain Anak; action=ready_sebagai_data_awal_fasilitas_umum; note=Diisi dari ringkasan fasilitas yang diberikan user/AI agent: Area Parkir, Toilet, Mushola, Area Makan Lesehan, Taman Bermain Anak. Kolom kursi roda dan pet friendly tetap ? jika tidak disebut eksplisit.; revision=Sebelumnya kosong total, kini fasilitas utama sudah terisi.",auto_rule_v1,True,True,False,False,updated_master_status_facility_2026-05-27:facility,True,False,True,True,False,False,unknown,,True,21.24,,False,0.5656565656565656,tfidf_linearsvc,run_nlp_pipeline_v2,True,True,https://res.cloudinary.com/dnfnyjdmj/image/upload/v1781778579/muterbandung/wisata/LOC-074_main.jpg,https://www.google.com/maps/search/?api=1&query=Rumah%20Makan%20Sangu%20Liwet%20Ibu%20Ika%20Pasirjambu%20Ciwidey&query_place_id=ChIJW8r6bmbtaC4Rkich2i85QXI,http://sanguliwetbuika.blogspot.co.id/,google_maps_extractor_2026_05_19,,Rumah Makan Sangu Liwet Ibu Ika Pasirjambu Ciwidey,1.0,exact_normalized_title,accepted,Exact normalized title match.,Unknown,Unknown
LOC-075,Sanghyang Heuleut,Wisata Alam,"['Alam', 'Spot Foto', 'Kuliner', 'Santai/Healing', 'Wahana Ekstrem']",0.6428571428571429,56.0,Sangat Positif,-6.8764679,107.341682,20000.0,20000.0,08:00,16:00,120.0,"Kolam alami terpencil dengan air kobalt, dapat diakses dengan jalur pendakian di ngarai sempit dan berbatu.",Per Orang,Danau alami,"Alam, Outdoor, Pemandangan, Udara Segar",08:00,16:00,08:00,17:00,internet_research_verified,internet_research_verified,filled_from_reliable_source,verified,"Jadwal weekday dan weekend berbeda, keduanya terisi dari sumber.",4.214285714285714,45.0,9.0,Alam,Alam;Santai/Healing;Spot Foto,Outdoor,Belanja;Indoor;Religi,0.958,False,,"Alam: category=Wisata Alam (+4) | subcategory keyword: danau (+1.2) | tags keyword: alam, pemandangan (+2.1) || Santai/Healing: category=Wisata Alam (+1.5) | tags keyword: pemandangan (+1.05) | old multi_labels=Santai/Healing (+1) || Spot Foto: category=Wisata Alam (+1.5) | tags keyword: pemandangan (+1.05) | old multi_labels=Spot Foto (+1) || Outdoor: category=Wisata Alam (+2.5) | subcategory keyword: danau (+1.2) | tags keyword: outdoor, alam (+2.1)","{""Alam"": 8.3, ""Belanja"": -2.0, ""Kuliner"": -1.25, ""Outdoor"": 5.8, ""Petualangan"": 0.25, ""Santai/Healing"": 3.55, ""Spot Foto"": 3.55}",auto_rule_v1,auto_approved,,,,,Alam,Alam;Santai/Healing;Spot Foto,Outdoor,Belanja;Indoor;Religi,keep,active_candidate,,,,auto_rule_v1,True,False,False,False,,False,False,False,False,False,False,unknown,,True,29.73,,False,0.6428571428571429,tfidf_linearsvc,run_nlp_pipeline_v2,True,True,https://res.cloudinary.com/dnfnyjdmj/image/upload/v1781778581/muterbandung/wisata/LOC-075_main.jpg,https://www.google.com/maps/search/?api=1&query=Sanghyang%20Heuleut&query_place_id=ChIJhZQ93yH5aC4RvQf1HVZ3tzc,,google_maps_extractor_2026_05_19,,Sanghyang Heuleut,1.0,exact_normalized_title,accepted,Exact normalized title match.,Unknown,Unknown
