LOC-167,Cicalengka Dreamland,Rekreasi Keluarga,"['Alam', 'Ramah Anak', 'Spot Foto', 'Kuliner']",0.3617021276595745,47.0,Positif,-6.9686051,107.8855249,25000.0,40000.0,09:00,17:00,180.0,"Taman keluarga dengan zip line, area bermain & tempat berfoto yang berlatar gunung atau sawah.",Per Orang,Taman rekreasi tematik,"Keluarga, Anak-anak, Wahana, Seru",09:00,17:00,08:00,18:00,internet_research_verified,internet_research_verified,filled_from_reliable_source,verified,"Jadwal weekday dan weekend berbeda, keduanya terisi dari sumber.",3.808510638297872,29.0,12.0,Keluarga,Keluarga;Ramah Anak;Alam,Santai/Healing;Gratis;Outdoor,Belanja,1.0,False,,"Keluarga: category=Rekreasi Keluarga (+4.5) | tags keyword: keluarga, anak, anak-anak, wahana (+4.2) | description keyword: keluarga (+0.75) || Ramah Anak: category=Rekreasi Keluarga (+2.5) | tags keyword: anak, anak-anak (+2.1) | old multi_labels=Ramah Anak (+1) || Alam: description keyword: gunung (+0.75) | old multi_labels=Alam (+1) | family attraction with explicit nature evidence (+2) || Santai/Healing: subcategory keyword: taman (+1.2) | description keyword: taman (+0.75) || Gratis: price_type/price_max indicates free (+3) || Outdoor: subcategory keyword: taman (+1.2) | description keyword: taman, gunung (+1.5)","{""Alam"": 3.75, ""Belanja"": -2.0, ""Gratis"": 3.0, ""Keluarga"": 9.45, ""Kuliner"": -1.25, ""Outdoor"": 2.7, ""Ramah Anak"": 5.6, ""Santai/Healing"": 1.95, ""Spot Foto"": 0.25}",auto_rule_v1,auto_approved,,,,,Keluarga,Keluarga;Ramah Anak;Alam,Santai/Healing;Outdoor,Belanja;Gratis,keep,active_candidate,True,,"QA override: ticketed family park; do not treat as free entry. | Updated master status/facility 2026-05-27; facility_status=lengkap; facility_evidence=ringkasan_agent_belum_url_per_baris; facilities=Area Parkir, Toilet, Mushola, Flying Fox, Spot Foto Religi, Cafe, Wahana Bermain; action=ready_sebagai_data_awal_fasilitas_umum; note=Diisi dari ringkasan fasilitas yang diberikan user/AI agent: Area Parkir, Toilet, Mushola, Flying Fox, Spot Foto Religi, Cafe, Wahana Bermain. Kolom kursi roda dan pet friendly tetap ? jika tidak disebut eksplisit.; revision=Sebelumnya kosong total, kini fasilitas utama sudah terisi.",realworld_qa_override,True,False,False,True,updated_master_status_facility_2026-05-27:facility,True,False,True,True,False,False,unknown,,True,31.17,,True,0.3617021276595745,tfidf_linearsvc,run_nlp_pipeline_v2,True,True,https://res.cloudinary.com/dnfnyjdmj/image/upload/v1781778692/muterbandung/wisata/LOC-167_main.jpg,https://www.google.com/maps/search/?api=1&query=Cicalengka%20Dreamland&query_place_id=ChIJKRu4VcvPaC4RLwRHWB98sa4,http://cicalengkadreamland.com/,google_maps_extractor_2026_05_19,,Cicalengka Dreamland,1.0,exact_normalized_title,accepted,Exact normalized title match.,Unknown,Unknown
LOC-168,Curug Cinulang,Wisata Alam,"['Alam', 'Spot Foto', 'Kuliner']",0.7530864197530864,81.0,Sangat Positif,-6.9628443,107.881471,10000.0,15000.0,08:00,16:00,120.0,Sepasang air terjun yang mengalir melalui tebing & dapat diakses dengan jalan kayu curam di jurang sempit.,Per Orang,Daya tarik alam,"Alam, Outdoor, Pemandangan, Udara Segar",08:00,16:00,08:00,17:00,internet_research_verified,internet_research_verified,filled_from_reliable_source,verified,"Jadwal weekday dan weekend berbeda, keduanya terisi dari sumber.",4.271604938271605,66.0,5.0,Alam,Alam;Spot Foto;Outdoor,Santai/Healing,Belanja;Indoor;Religi,1.0,False,,"Alam: category=Wisata Alam (+4) | subcategory keyword: alam (+1.2) | tags keyword: alam, pemandangan (+2.1) || Spot Foto: category=Wisata Alam (+1.5) | tags keyword: pemandangan (+1.05) | description keyword: tebing (+0.75) || Outdoor: category=Wisata Alam (+2.5) | subcategory keyword: alam (+1.2) | tags keyword: outdoor, alam (+2.1) || Santai/Healing: category=Wisata Alam (+1.5) | tags keyword: pemandangan (+1.05)","{""Alam"": 10.4, ""Belanja"": -2.0, ""Kuliner"": -1.25, ""Outdoor"": 6.4, ""Santai/Healing"": 2.55, ""Spot Foto"": 4.3}",auto_rule_v1,auto_approved,,,,,Alam,Alam;Spot Foto;Outdoor,Santai/Healing,Belanja;Indoor;Religi,keep,active_candidate,,,,auto_rule_v1,True,False,False,False,,False,False,False,False,False,False,unknown,,True,30.63,,False,0.7530864197530864,tfidf_linearsvc,run_nlp_pipeline_v2,True,True,https://res.cloudinary.com/dnfnyjdmj/image/upload/v1781778694/muterbandung/wisata/LOC-168_main.jpg,https://www.google.com/maps/search/?api=1&query=Curug%20Cinulang&query_place_id=ChIJDbM48vTPaC4RacUQQPXUjsc,,google_maps_extractor_2026_05_19,,Curug Cinulang,1.0,exact_normalized_title,accepted,Exact normalized title match.,Unknown,Unknown
LOC-169,Dago Bakery Punclut,Tempat Kuliner,"['Alam', 'Spot Foto', 'Kuliner']",0.6890322580645162,775.0,Sangat Positif,-6.8423415,107.6228747,20000.0,25000.0,09:00,21:00,90.0,Restoran kuliner bergaya kastil Eropa klasik di Lembang yang menyajikan aneka roti dan hidangan lezat dengan panorama perbukitan yang menawan.,Per Orang,Bakery wisata,"Kuliner, Nongkrong, Santai",09:00,21:00,08:00,21:00,internet_research_verified,internet_research_verified,filled_from_reliable_source,verified,"Jadwal weekday dan weekend berbeda, keduanya terisi dari sumber.",4.24,630.0,96.0,Kuliner,Kuliner;Santai/Healing,Spot Foto;Malam,Belanja;Petualangan;Religi;Sejarah,1.0,False,,"Kuliner: category=Tempat Kuliner (+5) | tags keyword: kuliner (+1.05) | description keyword: kuliner, restoran (+1.5) || Santai/Healing: category=Tempat Kuliner (+2) | tags keyword: santai, nongkrong (+2.1) || Spot Foto: description keyword: panorama (+0.75) | old multi_labels=Spot Foto (+1) || Malam: opening hours support night visit (+1.5)","{""Alam"": -0.75, ""Belanja"": -2.0, ""Kuliner"": 8.55, ""Malam"": 1.5, ""Santai/Healing"": 4.1, ""Spot Foto"": 1.75}",auto_rule_v1,auto_approved,,,,,Kuliner,Kuliner;Santai/Healing,Spot Foto;Malam,Belanja;Petualangan;Religi;Sejarah,keep,active_candidate,,,"Updated master status/facility 2026-05-27; facility_status=lengkap; facility_evidence=ringkasan_agent_belum_url_per_baris; facilities=Area Parkir, Toilet, Mushola, Restoran Berkonsep Kastil, Spot Foto; action=ready_sebagai_data_awal_fasilitas_umum; note=Diisi dari ringkasan fasilitas yang diberikan user/AI agent: Area Parkir, Toilet, Mushola, Restoran Berkonsep Kastil, Spot Foto. Kolom kursi roda dan pet friendly tetap ? jika tidak disebut eksplisit.; revision=Sebelumnya kosong total, kini fasilitas utama sudah terisi.",auto_rule_v1,True,True,False,False,updated_master_status_facility_2026-05-27:facility,True,False,True,True,False,False,unknown,,True,9.0,,False,0.6890322580645162,tfidf_linearsvc,run_nlp_pipeline_v2,True,True,https://res.cloudinary.com/dnfnyjdmj/image/upload/v1781778695/muterbandung/wisata/LOC-169_main.jpg,https://www.google.com/maps/search/?api=1&query=Dago%20Bakery%20punclut&query_place_id=ChIJC1zpuynhaC4Rv3W00zM1Fls,http://www.dagobakery.com/,google_maps_extractor_2026_05_19,,Dago Bakery punclut,1.0,exact_normalized_title,accepted,Exact normalized title match.,Unknown,Unknown
LOC-170,Tafso Barn,Tempat Kuliner,"['Alam', 'Ramah Anak', 'Spot Foto', 'Kuliner', 'Santai/Healing']",0.7210526315789474,190.0,Sangat Positif,-6.8424051,107.6227991,19000.0,50000.0,11:00,22:00,90.0,"Tafso Barn adalah restoran tematik bernuansa taman lereng bukit di kawasan Punclut yang menawarkan tempat duduk unik mirip sangkar burung, spot foto estetik, dan panorama alam sejuk.",Per Orang,Restoran wisata,"Kuliner, Nongkrong, Santai",12:00,20:00,09:00,20:30,internet_research_verified,internet_research_verified,filled_from_reliable_source,verified,"Jadwal weekday dan weekend berbeda, keduanya terisi dari sumber.",4.247368421052632,153.0,16.0,Kuliner,Kuliner;Santai/Healing;Alam,Spot Foto;Malam;Outdoor,Belanja;Petualangan;Religi;Sejarah,0.95,True,Alam core label suspicious for non-nature category,"Kuliner: category=Tempat Kuliner (+5) | subcategory keyword: restoran (+1.2) | tags keyword: kuliner (+1.05) || Santai/Healing: category=Tempat Kuliner (+2) | tags keyword: santai, nongkrong (+2.1) | description keyword: taman, sejuk (+1.5) || Alam: description keyword: alam, bukit, panorama, sejuk (+3) | old multi_labels=Alam (+1) || Spot Foto: description keyword: foto, spot foto, panorama, bukit (+3) | old multi_labels=Spot Foto (+1) || Malam: opening hours support night visit (+1.5) || Outdoor: description keyword: alam, taman (+1.5)","{""Alam"": 4.0, ""Belanja"": -2.0, ""Kuliner"": 9.0, ""Malam"": 1.5, ""Outdoor"": 1.5, ""Ramah Anak"": 0.25, ""Santai/Healing"": 6.6, ""Spot Foto"": 4.0}",auto_rule_v1,needs_reverification,Kuliner,Kuliner;Santai/Healing;Spot Foto,Outdoor;Alam;Malam,Belanja;Petualangan;Religi;Sejarah,Kuliner,Kuliner;Santai/Healing;Spot Foto,Outdoor;Alam;Malam,Belanja;Petualangan;Religi;Sejarah,needs_review,status_uncertain,False,0.66,"Alam sebaiknya secondary, bukan core. Ada sumber terbaru menandai permanently closed, jadi perlu verifikasi aktif sebelum dipakai.",manual_browser_review_v1,True,True,False,False,,False,False,False,False,False,False,unknown,,True,8.99,,True,0.7210526315789474,tfidf_linearsvc,run_nlp_pipeline_v2,True,True,https://res.cloudinary.com/dnfnyjdmj/image/upload/v1781778696/muterbandung/wisata/LOC-170_main.jpg,https://www.google.com/maps/search/?api=1&query=Tafso%20Barn&query_place_id=ChIJR4j-ndXgaC4R7nY8HM89Ico,http://instagram.com/heytafso/?hl=en,google_maps_extractor_2026_05_19,,Tafso Barn,1.0,exact_normalized_title,accepted,Exact normalized title match.,Unknown,Unknown
LOC-171,D'Dieuland,Rekreasi Keluarga,"['Alam', 'Ramah Anak', 'Spot Foto', 'Kuliner', 'Belanja', 'Santai/Healing', 'Wahana Ekstrem']",0.7692307692307693,52.0,Sangat Positif,-6.8420561,107.6233591,10000.0,20000.0,09:00,22:00,180.0,"D'Dieuland adalah destinasi wisata terpadu di lereng Punclut Bandung yang menyajikan sky walk setinggi 10 meter, wahana playground anak, giant swing, serta restoran berpemandangan indah.",Per Orang,Kawasan rekreasi,"Keluarga, Anak-anak, Wahana, Seru",11:00,19:00,09:00,21:00,internet_research_verified,internet_research_verified,filled_from_reliable_source,verified,"Jadwal weekday dan weekend berbeda, keduanya terisi dari sumber.",4.153846153846154,44.0,4.0,Keluarga,Keluarga;Ramah Anak;Kuliner,Malam,Belanja,1.0,False,,"Keluarga: category=Rekreasi Keluarga (+4.5) | tags keyword: keluarga, anak, anak-anak, wahana (+4.2) | description keyword: anak, wahana (+1.5) || Ramah Anak: category=Rekreasi Keluarga (+2.5) | tags keyword: anak, anak-anak (+2.1) | description keyword: anak, playground (+1.5) || Kuliner: description keyword: restoran (+0.75) | old multi_labels=Kuliner (+1) | family attraction with explicit culinary evidence (+2.5) || Malam: opening hours support night visit (+1.5)","{""Alam"": 0.25, ""Belanja"": -1.75, ""Keluarga"": 10.2, ""Kuliner"": 4.25, ""Malam"": 1.5, ""Petualangan"": 0.25, ""Ramah Anak"": 7.1, ""Santai/Healing"": 0.25, ""Spot Foto"": 0.25}",auto_rule_v1,auto_approved,,,,,Keluarga,Keluarga;Ramah Anak;Kuliner,Malam,Belanja,keep,active_candidate,,,"Updated master status/facility 2026-05-27; facility_status=lengkap; facility_evidence=ringkasan_agent_belum_url_per_baris; facilities=Area Parkir, Toilet, Mushola, Playground, Spot Foto, Restoran; action=ready_sebagai_data_awal_fasilitas_umum; note=Diisi dari ringkasan fasilitas yang diberikan user/AI agent: Area Parkir, Toilet, Mushola, Playground, Spot Foto, Restoran. Kolom kursi roda dan pet friendly tetap ? jika tidak disebut eksplisit.; revision=Sebelumnya kosong total, kini fasilitas utama sudah terisi.",auto_rule_v1,True,True,False,True,updated_master_status_facility_2026-05-27:facility,True,False,True,True,False,False,unknown,,True,9.04,,False,0.7692307692307693,tfidf_linearsvc,run_nlp_pipeline_v2,True,True,https://res.cloudinary.com/dnfnyjdmj/image/upload/v1781778698/muterbandung/wisata/LOC-171_main.jpg,https://www.google.com/maps/search/?api=1&query=D%E2%80%99Dieuland&query_place_id=ChIJCcsMvtXgaC4RnoLxtrV8Ymc,,google_maps_extractor_2026_05_19,,D’Dieuland,1.0,exact_normalized_title,accepted,Exact normalized title match.,Unknown,Unknown
LOC-172,Sudut Pandang Bandung,Tempat Kuliner,"['Alam', 'Spot Foto', 'Kuliner']",0.868020304568528,1182.0,Sangat Positif,-6.8423638,107.6232403,75000.0,85000.0,12:00,22:00,90.0,"Ruang bergaya untuk selfie, dengan igloo dari kaca, pameran multimedia & restoran berpanorama indah.",Per Orang,Restoran wisata,"Kuliner, Nongkrong, Santai",12:00,22:00,12:00,22:00,internet_research_verified,internet_research_verified,filled_from_reliable_source,general_schedule_used_for_both,Jadwal umum digunakan untuk weekday dan weekend.,4.579526226734348,1072.0,46.0,Kuliner,Kuliner;Santai/Healing,Malam,Alam;Belanja;Petualangan;Religi;Sejarah,1.0,False,,"Kuliner: category=Tempat Kuliner (+5) | subcategory keyword: restoran (+1.2) | tags keyword: kuliner (+1.05) || Santai/Healing: category=Tempat Kuliner (+2) | tags keyword: santai, nongkrong (+2.1) || Malam: opening hours support night visit (+1.5)","{""Alam"": -2.25, ""Belanja"": -2.0, ""Kuliner"": 9.0, ""Malam"": 1.5, ""Santai/Healing"": 4.1, ""Spot Foto"": 0.25}",auto_rule_v1,auto_approved,,,,,Kuliner,Kuliner;Santai/Healing,Malam,Alam;Belanja;Petualangan;Religi;Sejarah,keep,active_candidate,,,"Updated master status/facility 2026-05-27; facility_status=sebagian; facility_evidence=mengikuti_catatan_lama; facilities=Area Parkir, Toilet, Mushola; action=review_sumber_lama_jika_perlu; note=Cafe di Lembang kawasan Lereng Anteng. Parkir, toilet, mushola tersedia.; revision=Data dari tabel fasilitas sebelumnya dipertahankan.",auto_rule_v1,True,True,False,False,updated_master_status_facility_2026-05-27:facility,True,False,True,True,False,False,unknown,,True,9.01,,False,0.868020304568528,tfidf_linearsvc,run_nlp_pipeline_v2,True,True,https://res.cloudinary.com/dnfnyjdmj/image/upload/v1781778699/muterbandung/wisata/LOC-172_main.jpg,https://www.google.com/maps/search/?api=1&query=Sudut%20Pandang%20Bandung&query_place_id=ChIJg5aI7frhaC4REqh7jx3_LZM,https://www.instagram.com/sudutpandang.bdg/?hl=en,google_maps_extractor_2026_05_19,,Sudut Pandang Bandung,1.0,exact_normalized_title,accepted,Exact normalized title match.,Unknown,Unknown
LOC-173,Cakrawala Nature Sparkling Restaurant,Tempat Kuliner,"['Alam', 'Ramah Anak', 'Spot Foto', 'Kuliner']",0.5555555555555556,18.0,Positif,-6.8421396,107.6230737,50000.0,50000.0,11:00,22:00,90.0,Cakrawala Sparkling Nature Restaurant adalah restoran tematik instagramable di Punclut dengan beberapa area konsep unik (seperti Galaxy dan Pelangi) serta jembatan kaca Skywalk setinggi 20 meter.,Per Orang,Restoran wisata,"Kuliner, Nongkrong, Santai",09:00,21:00,09:00,22:00,internet_research_verified,internet_research_verified,filled_from_reliable_source,verified,"Jadwal weekday dan weekend berbeda, keduanya terisi dari sumber.",3.5,14.0,4.0,Kuliner,Kuliner;Santai/Healing,Spot Foto;Malam,Alam;Belanja;Petualangan;Religi;Sejarah,1.0,False,,"Kuliner: category=Tempat Kuliner (+5) | subcategory keyword: restoran (+1.2) | tags keyword: kuliner (+1.05) || Santai/Healing: category=Tempat Kuliner (+2) | tags keyword: santai, nongkrong (+2.1) || Spot Foto: description keyword: instagramable (+0.75) | old multi_labels=Spot Foto (+1) || Malam: opening hours support night visit (+1.5)","{""Alam"": -2.25, ""Belanja"": -2.0, ""Kuliner"": 10.35, ""Malam"": 1.5, ""Ramah Anak"": 0.25, ""Santai/Healing"": 4.1, ""Spot Foto"": 1.75}",auto_rule_v1,reviewed,,,,,Kuliner,Kuliner;Santai/Healing,Spot Foto;Malam,Alam;Belanja;Petualangan;Religi;Sejarah,keep,active_candidate,True,,"Updated master status/facility 2026-05-27; status=✓ Aktif; decision=include_active; confidence=Medium; sources=nagantour.com, berbagai review; note=Aktif. Restoran di bukit dengan view Bandung. Menyajikan western & masakan Bandung. Populer untuk sunset.; revision=Data awal dipertahankan dari tabel sebelumnya. | Updated master status/facility 2026-05-27; facility_status=lengkap; facility_evidence=ringkasan_agent_belum_url_per_baris; facilities=Area Parkir, Toilet, Mushola, Restoran Unik berkonsep Galaksi/Kaca, Spot Foto; action=ready_sebagai_data_awal_fasilitas_umum; note=Diisi dari ringkasan fasilitas yang diberikan user/AI agent: Area Parkir, Toilet, Mushola, Restoran Unik berkonsep Galaksi/Kaca, Spot Foto. Kolom kursi roda dan pet friendly tetap ? jika tidak disebut eksplisit.; revision=Sebelumnya kosong total, kini fasilitas utama sudah terisi.",auto_rule_v1,True,True,False,False,updated_master_status_facility_2026-05-27:status:include_active | updated_master_status_facility_2026-05-27:facility,True,False,True,True,False,False,unknown,,True,9.03,,False,0.5555555555555556,tfidf_linearsvc,run_nlp_pipeline_v2,True,True,https://res.cloudinary.com/dnfnyjdmj/image/upload/v1781778701/muterbandung/wisata/LOC-173_main.jpg,https://images.unsplash.com/photo-1517248135467-4c7edcad34c4?w=800&q=80,,manual_excel_2026-06-09,,Cakrawala Nature Sparkling Restaurant,1.0,manual_excel,manual_accepted,Manual media filled from Daftar_Destinasi_Wisata_Bandung_Professional.xlsx on 2026-06-09.,Unknown,Unknown
LOC-174,Lereng Anteng Panoramic Coffee,Tempat Kuliner,['Umum'],0.866667,30.0,Sangat Positif,-6.8428782,107.6221498,22000.0,22000.0,08:00,18:00,90.0,Lereng Anteng Panoramic Coffee adalah kafe santai populer di lereng bukit Punclut dengan tempat duduk saung tenda transparan estetik yang menyajikan pemandangan alam pegunungan Lembang.,Per Orang,Coffee shop,"Kuliner, Nongkrong, Santai",08:00,22:00,08:00,23:00,internet_research_verified,internet_research_verified,filled_from_reliable_source,verified,"Jadwal weekday dan weekend berbeda, keduanya terisi dari sumber.",4.533333,28.0,2.0,Kuliner,Kuliner;Santai/Healing,Spot Foto;Malam,Belanja;Petualangan;Religi;Sejarah,0.85,False,,"Kuliner: category=Tempat Kuliner (+5) | subcategory keyword: coffee (+1.2) | tags keyword: kuliner (+1.05) || Santai/Healing: category=Tempat Kuliner (+2) | subcategory keyword: coffee (+1.2) | tags keyword: santai, nongkrong (+2.1) || Spot Foto: description keyword: pemandangan, bukit (+1.5) || Malam: opening hours support night visit (+1.5)","{""Alam"": -0.25, ""Belanja"": -2.0, ""Kuliner"": 9.35, ""Malam"": 1.5, ""Outdoor"": 0.75, ""Santai/Healing"": 8.15, ""Spot Foto"": 1.5}",auto_rule_v1,reviewed,,,,,Kuliner,Kuliner;Santai/Healing,Spot Foto;Malam,Belanja;Petualangan;Religi;Sejarah,keep,active_candidate,True,,"Manual reviewer override 2026-05-26: active cafe context confirmed in DOCX. Existing hours retained: weekday 08:00-22:00, weekend 08:00-23:00. Sources: manual_reviewer_docx_2026-05-26 | Updated master status/facility 2026-05-27; facility_status=sebagian; facility_evidence=mengikuti_catatan_lama; facilities=Area Parkir, Toilet, Mushola; action=review_sumber_lama_jika_perlu; note=Parkir luas, toilet bersih, mushola ada. Cafe di lereng berundak, kursi roda tidak cocok.; revision=Data dari tabel fasilitas sebelumnya dipertahankan.",auto_rule_v1,True,True,False,False,manual_docx_override:active_status | updated_master_status_facility_2026-05-27:facility,True,False,True,True,False,False,unknown,,True,8.93,,False,0.866667,google_maps_stars_fallback,compass_manual_accepted_2026-06-09,True,True,https://res.cloudinary.com/dnfnyjdmj/image/upload/v1781778703/muterbandung/wisata/LOC-174_main.jpg,https://images.unsplash.com/photo-1554118811-1e0d58224f24?w=800&q=80,,manual_excel_2026-06-09,,Lereng Anteng Panoramic Coffee,1.0,manual_excel,manual_accepted,Manual media filled from Daftar_Destinasi_Wisata_Bandung_Professional.xlsx on 2026-06-09.,Unknown,Unknown
LOC-175,Taman Kupu-Kupu Cihanjuang,Wisata Satwa,['Alam'],0.7916666666666666,48.0,Sangat Positif,-6.8590047,107.568779,20000.0,20000.0,08:00,17:00,90.0,"Taman Kupu-Kupu Cihanjuang adalah taman edukasi keluarga seluas 1,8 hektar di Parongpong habitat bagi puluhan spesies kupu-kupu yang menyuguhkan rumah kepompong dan insectarium.",Per Orang,Wisata satwa,"Wisata, Umum, Menarik",08:00,17:00,08:00,17:00,internet_research_verified,internet_research_verified,filled_from_reliable_source,general_schedule_used_for_both,Jadwal umum digunakan untuk weekday dan weekend.,4.5625,41.0,3.0,Keluarga,Keluarga;Edukasi;Ramah Anak,Outdoor,Belanja;Kuliner,0.534,False,confidence < 0.65,Keluarga: category=Wisata Satwa (+3.5) | description keyword: keluarga (+0.75) || Edukasi: category=Wisata Satwa (+3) | description keyword: edukasi (+0.75) || Ramah Anak: category=Wisata Satwa (+3) || Outdoor: category=Wisata Satwa (+1.5) | description keyword: taman (+0.75) | name keyword: taman (+0.6),"{""Alam"": 0.25, ""Belanja"": -2.0, ""Edukasi"": 3.75, ""Keluarga"": 4.25, ""Kuliner"": -1.5, ""Outdoor"": 2.85, ""Ramah Anak"": 3.0, ""Santai/Healing"": 1.35}",auto_rule_v1,reviewed_keep,Edukasi,Edukasi;Keluarga;Ramah Anak,Outdoor;Spot Foto,Belanja;Kuliner;Malam,Edukasi,Edukasi;Keluarga;Ramah Anak,Outdoor;Spot Foto,Belanja;Kuliner;Malam,keep,active_candidate,True,0.84,"Primary lebih tepat Edukasi karena daya tarik utama taman konservasi/edukasi kupu-kupu, insectarium, dan pembelajaran satwa.",manual_browser_review_v1,True,False,False,True,,False,False,False,False,False,False,unknown,,True,8.16,,True,0.7916666666666666,tfidf_linearsvc,run_nlp_pipeline_v2,True,True,https://res.cloudinary.com/dnfnyjdmj/image/upload/v1781778704/muterbandung/wisata/LOC-175_main.jpg,https://www.google.com/maps/search/?api=1&query=Taman%20Kupu-Kupu%20Cihanjuang&query_place_id=ChIJ87h0BRvkaC4Rnt9wmgSwFVQ,http://tamankupu-kupucihanjuang.blogspot.com/,google_maps_extractor_2026_05_19,,Taman Kupu-Kupu Cihanjuang,1.0,exact_normalized_title,accepted,Exact normalized title match.,Unknown,Unknown
LOC-176,Padepokan Dayang Sumbi,Tempat Belajar,['Umum'],0.933333,30.0,Sangat Positif,-6.9013623,107.6387264,85000.0,85000.0,08:00,17:00,90.0,Padepokan Dayang Sumbi adalah destinasi edukasi serikultur (budidaya ulat sutra) di Cimenyan yang memperagakan seluruh siklus hidup ulat sutra serta proses pemintalan dan penenunan kain sutra.,Per Orang,Edukasi budaya dan alam,"Wisata, Umum, Menarik",09:00,17:00,09:00,17:00,internet_research_verified,internet_research_verified,filled_from_reliable_source,general_schedule_used_for_both,Jadwal umum digunakan untuk weekday dan weekend.,4.7,28.0,0.0,Edukasi,Edukasi,Indoor,Belanja;Kuliner;Petualangan,0.928,False,,Edukasi: category=Tempat Belajar (+5) | subcategory keyword: edukasi (+1.2) | description keyword: edukasi (+0.75) || Indoor: category=Tempat Belajar (+2),"{""Alam"": -1.3, ""Belanja"": -2.0, ""Budaya"": 1.2, ""Edukasi"": 6.95, ""Indoor"": 2.0, ""Keluarga"": 1.0, ""Kuliner"": -1.5, ""Outdoor"": 1.2}",auto_rule_v1,reviewed,,,,,Edukasi,Edukasi,Indoor,Belanja;Kuliner;Petualangan,keep,active_candidate,True,,"Updated master status/facility 2026-05-27; status=✓ Aktif; decision=include_active; confidence=Medium; sources=wisatasutra.wordpress.com, sebandung.com Feb 2024; note=Berganti nama jadi Wisata Ilmu Sutera Bandung (wisatasutera.com). Buka setiap hari, sesi 09:00–11:00 dan 12:00–14:30. Wajib reservasi.; revision=Data awal dipertahankan dari tabel sebelumnya.",auto_rule_v1,True,False,True,False,updated_master_status_facility_2026-05-27:status:include_active,False,False,False,False,False,False,unknown,,True,4.17,,False,0.933333,google_maps_stars_fallback,compass_manual_accepted_2026-06-09,True,True,https://images.unsplash.com/photo-1503676260728-1c00da094a0b?w=800&q=80,https://images.unsplash.com/photo-1503676260728-1c00da094a0b?w=800&q=80,,manual_excel_2026-06-09,,Padepokan Dayang Sumbi,1.0,manual_excel,manual_accepted,Manual media filled from Daftar_Destinasi_Wisata_Bandung_Professional.xlsx on 2026-06-09.,Unknown,Unknown
LOC-177,Wahoo Waterworld,Wahana Air,['Wahana Ekstrem'],0.961352657004831,207.0,Sangat Positif,-6.8599638,107.4630882,92000.0,130000.0,09:00,17:00,90.0,Waterpark megah seluas 10 hektar di Kota Baru Parahyangan Padalarang yang memiliki wahana air seluncuran ekstrem RocketBLAST tercepat di Asia Tenggara.,Per Orang,Waterworld,"Wisata, Umum, Menarik",09:00,17:00,09:00,17:00,internet_research_verified,internet_research_verified,filled_from_reliable_source,general_schedule_used_for_both,Jadwal umum digunakan untuk weekday dan weekend.,4.942028985507246,202.0,3.0,Keluarga,Keluarga;Petualangan,Ramah Anak,Belanja;Kuliner,0.534,False,confidence < 0.65,Keluarga: category=Wahana Air (+3.5) | description keyword: wahana (+0.75) || Petualangan: category=Wahana Air (+2) | description keyword: ekstrem (+0.75) | old multi_labels=Wahana Ekstrem (+1) || Ramah Anak: category=Wahana Air (+2.5),"{""Belanja"": -2.0, ""Keluarga"": 4.25, ""Kuliner"": -1.5, ""Outdoor"": 1.0, ""Petualangan"": 3.75, ""Ramah Anak"": 2.5}",auto_rule_v1,reviewed_keep,Keluarga,Keluarga;Ramah Anak;Petualangan,Outdoor;Santai/Healing,Belanja;Sejarah;Religi,Keluarga,Keluarga;Ramah Anak;Petualangan,Outdoor;Santai/Healing,Belanja;Sejarah;Religi,keep,active_candidate,True,0.9,"Petualangan valid core karena banyak wahana ekstrem. Ramah Anak juga core karena ada Aqua Zone, Splash Zone, Play Zone, dan area anak. | Updated master status/facility 2026-05-27; facility_status=lengkap; facility_evidence=mengikuti_catatan_lama; facilities=Area Parkir, Toilet, Mushola, Akses/Kursi Roda; action=review_sumber_lama_jika_perlu; revision=Data dari tabel fasilitas sebelumnya dipertahankan.",manual_browser_review_v1,True,False,False,True,updated_master_status_facility_2026-05-27:facility,True,True,True,True,False,False,unknown,,True,17.32,,False,0.961352657004831,tfidf_linearsvc,run_nlp_pipeline_v2,True,True,https://res.cloudinary.com/dnfnyjdmj/image/upload/v1781778705/muterbandung/wisata/LOC-177_main.jpg,https://images.unsplash.com/photo-1583417319070-4a69db38a482?w=800&q=80,,manual_excel_2026-06-09,,Wahoo Waterworld,1.0,manual_excel,manual_accepted,Manual media filled from Daftar_Destinasi_Wisata_Bandung_Professional.xlsx on 2026-06-09.,Unknown,Unknown
